,joke,tokens,token_count,funny,clean_text
1369,What's more undesirable than a male waiter? A man that can't see his feet nor his penis.,"['What', 'undesirable', 'male', 'waiter', 'A', 'man', 'see', 'feet', 'penis']",9,0,what undesirable male waiter a man see feet penis 
1370,My wife bet me $1000 I couldn’t turn spaghetti into a car. You should have see her face when I drove pasta.,"['My', 'wife', 'bet', '1000', 'I', 'turn', 'spaghetti', 'car', 'You', 'see', 'face', 'I', 'drove', 'pasta']",13,1,my wife bet 1000 i turn spaghetti car you see face i drove pasta 
1371,What do you call a cow with no legs? immooooobile.,"['What', 'call', 'cow', 'legs', 'immooooobile']",5,0,what call cow legs immooooobile 
1372,Why did the paraplegic cross the road? He needed a new set of wheels.,"['Why', 'paraplegic', 'cross', 'road', 'He', 'needed', 'new', 'set', 'wheels']",9,0,why paraplegic cross road he needed new set wheels 
1373,Have you seen the new streaming show about pickle making? It's called Netflix and Dill.,"['Have', 'seen', 'new', 'streaming', 'show', 'pickle', 'making', 'It', 'called', 'Netflix', 'Dill']",11,0,have seen new streaming show pickle making it called netflix dill 
1374,What to do you call a bee which is found in america? USB!,"['What', 'call', 'bee', 'found', 'america', 'USB']",6,0,what call bee found america usb 
1375,Have you ever tried to eat a clock? It's very time-consuming.,"['Have', 'ever', 'tried', 'eat', 'clock', 'It', 'time', 'consuming']",8,0,have ever tried eat clock it time consuming 
1376,"A Swede, Norwegian, and a Finnish walk into a bar. The bartender asks, ""What can I get for you?"" One just wants some meatballs, one responds in low guttural sounds, and the other no one can find.","['A', 'Swede', 'Norwegian', 'Finnish', 'walk', 'bar', 'The', 'bartender', 'asks', 'What', 'I', 'get', 'One', 'wants', 'meatballs', 'one', 'responds', 'low', 'guttural', 'sounds', 'one', 'find']",22,0,a swede norwegian finnish walk bar the bartender asks what i get one wants meatballs one responds low guttural sounds one find 
1377,Piñatas. Isn’t an Emo just a piñata for cannibals???,"['Piñatas', 'Isn', 'Emo', 'piñata', 'cannibals']",5,0,piñatas isn emo piñata cannibals 
1378,There's so many memes and online stories about Covid-19 It's like it got viral marketing.,"['There', 'many', 'memes', 'online', 'stories', 'Covid', '19', 'It', 'like', 'got', 'viral', 'marketing']",11,0,there many memes online stories covid 19 it like got viral marketing 
1379,My behind is broken. It’s got a crack in it!,"['My', 'behind', 'broken', 'It', 'got', 'crack']",6,1,my behind broken it got crack 
1380,"Did you hear about those french clothes that were too big? Made in Toulouse, apparently.","['Did', 'hear', 'french', 'clothes', 'big', 'Made', 'Toulouse', 'apparently']",8,1,did hear french clothes big made toulouse apparently 
1381,What type of bee... ...doesn't have an ego? Humblebee ...trips and falls? Stumblebee ...vibrates? Rumblebee ...loses a football game? Fumblebee ...bakes cookies? Crumblebee ...does a somersault? Tumblebee ...speaks softly? Mumblebee ...complains a lot? Grumblebee.,"['What', 'type', 'bee', 'ego', 'Humblebee', 'trips', 'falls', 'Stumblebee', 'vibrates', 'Rumblebee', 'loses', 'football', 'game', 'Fumblebee', 'bakes', 'cookies', 'Crumblebee', 'somersault', 'Tumblebee', 'speaks', 'softly', 'Mumblebee', 'complains', 'lot', 'Grumblebee']",25,1,what type bee ego humblebee trips falls stumblebee vibrates rumblebee loses football game fumblebee bakes cookies crumblebee somersault tumblebee speaks softly mumblebee complains lot grumblebee 
1382,"I used to work at a can crushing facility, but I quit. It was soda pressing.","['I', 'used', 'work', 'crushing', 'facility', 'I', 'quit', 'It', 'soda', 'pressing']",10,1,i used work crushing facility i quit it soda pressing 
1383,Where's Peter Pan's favourite place to eat out? Wendy's.,"['Where', 'Peter', 'Pan', 'favourite', 'place', 'eat', 'Wendy']",7,1,where peter pan favourite place eat wendy 
1384,"Last night I saw a band play American Woman, No Time and These Eyes. The bandleader confused everyone by saying ""Guess Who wrote these songs.""","['Last', 'night', 'I', 'saw', 'band', 'play', 'American', 'Woman', 'No', 'Time', 'These', 'Eyes', 'The', 'bandleader', 'confused', 'everyone', 'saying', 'Guess', 'Who', 'wrote', 'songs']",21,0,last night i saw band play american woman no time these eyes the bandleader confused everyone saying guess who wrote songs 
1385,Wanda's been blind with rage for a while now. Maybe cuz of her loss of vision.,"['Wanda', 'blind', 'rage', 'Maybe', 'cuz', 'loss', 'vision']",7,1,wanda blind rage maybe cuz loss vision 
1386,The Green Goblin really puts the napping in kidnapping.,"['The', 'Green', 'Goblin', 'really', 'puts', 'napping', 'kidnapping']",7,0,the green goblin really puts napping kidnapping 
1387,Some classicly cheesy car/automotive jokes. Source: [https://www.buffalocoresupply.com/blog/a-little-automotive-humor](https://www.buffalocoresupply.com/blog/a-little-automotive-humor) &amp;#x200B; what kind of cars do cats drive? catillacs. &amp;#x200B; why did the spider buy a sports car? so he could take it out for a spin. what happens to 13-year-old cars? they get car-mitzvahed. &amp;#x200B; when is a car not a car? when it turns into a driveway. what kind of cars do cooks drive? chef-rolets.,"['Some', 'classicly', 'cheesy', 'car', 'automotive', 'jokes', 'Source', 'https', 'www', 'buffalocoresupply', 'com', 'blog', 'little', 'automotive', 'humor', 'https', 'www', 'buffalocoresupply', 'com', 'blog', 'little', 'automotive', 'humor', 'amp', 'x200B', 'kind', 'cars', 'cats', 'drive', 'catillacs', 'amp', 'x200B', 'spider', 'buy', 'sports', 'car', 'could', 'take', 'spin', 'happens', '13', 'year', 'old', 'cars', 'get', 'car', 'mitzvahed', 'amp', 'x200B', 'car', 'car', 'turns', 'driveway', 'kind', 'cars', 'cooks', 'drive', 'chef', 'rolets']",55,0,some classicly cheesy car automotive jokes source https www buffalocoresupply com blog little automotive humor https www buffalocoresupply com blog little automotive humor amp x200b kind cars cats drive catillacs amp x200b spider buy sports car could take spin happens 13 year old cars get car mitzvahed amp x200b car car turns driveway kind cars cooks drive chef rolets 
1388,A ducking thief (thought this would fit here),"['A', 'ducking', 'thief', 'thought', 'would', 'fit']",6,0,a ducking thief thought would fit 
1389,What do you say when someone makes an unexpected sex joke? Didn't see that cumming.,"['What', 'say', 'someone', 'makes', 'unexpected', 'sex', 'joke', 'Didn', 'see', 'cumming']",10,0,what say someone makes unexpected sex joke didn see cumming 
1390,ha ha so funny bad meme ha ha im laughing. &amp;#x200B;,"['ha', 'ha', 'funny', 'bad', 'meme', 'ha', 'ha', 'im', 'laughing', 'amp', 'x200B']",10,0,ha ha funny bad meme ha ha im laughing amp x200b 
1391,Why is it always easy to find a stationary shop? Because they never move.,"['Why', 'always', 'easy', 'find', 'stationary', 'shop', 'Because', 'never', 'move']",9,1,why always easy find stationary shop because never move 
1392,Why did the bicycle fall over? Because it was two tired.,"['Why', 'bicycle', 'fall', 'Because', 'two', 'tired']",6,0,why bicycle fall because two tired 
1393,Dogs leave a scent flag on every corner and tree they pass. My son calls these messages... P-mail.,"['Dogs', 'leave', 'scent', 'flag', 'every', 'corner', 'tree', 'pass', 'My', 'son', 'calls', 'messages', 'P', 'mail']",14,1,dogs leave scent flag every corner tree pass my son calls messages p mail 
1394,What do cats agree with? Categories!,"['What', 'cats', 'agree', 'Categories']",4,0,what cats agree categories 
1395,Is this right for this sub?,"['Is', 'right', 'sub']",3,0,is right sub 
1396,I’m funny girl haha.,"['I', 'funny', 'girl', 'haha']",4,0,i funny girl haha 
1397,"Cut above the rest. A lumberjack cut his leg with his chainsaw. Paramedics managed to stop the bleeding, but he’s not out of the woods yet.","['Cut', 'rest', 'A', 'lumberjack', 'cut', 'leg', 'chainsaw', 'Paramedics', 'managed', 'stop', 'bleeding', 'woods', 'yet']",13,1,cut rest a lumberjack cut leg chainsaw paramedics managed stop bleeding woods yet 
1398,What do you call a freezing baby? Youth in ice.,"['What', 'call', 'freezing', 'baby', 'Youth', 'ice']",6,0,what call freezing baby youth ice 
1399,Justice is served cold because... If it were served warm it would be justwater.,"['Justice', 'served', 'cold', 'If', 'served', 'warm', 'would', 'justwater']",8,0,justice served cold if served warm would justwater 
1400,From my 7 yr old. Why are electric eels always surprised? Because to them everything is shocking.,"['From', '7', 'yr', 'old', 'Why', 'electric', 'eels', 'always', 'surprised', 'Because', 'everything', 'shocking']",11,1,from 7 yr old why electric eels always surprised because everything shocking 
1401,The farmer’s daughter asked if I had experience. I told her I’m no hoe but I know my way around a garden. Safe to say I didn’t get the job.,"['The', 'farmer', 'daughter', 'asked', 'I', 'experience', 'I', 'told', 'I', 'hoe', 'I', 'know', 'way', 'around', 'garden', 'Safe', 'say', 'I', 'get', 'job']",20,0,the farmer daughter asked i experience i told i hoe i know way around garden safe say i get job 
1402,How do fish get high. With seaweed.,"['How', 'fish', 'get', 'high', 'With', 'seaweed']",6,1,how fish get high with seaweed 
1403,"the difference between dad jokes and kid jokes is... Kid jokes have obvious punchlines, but dad jokes are more a parent.","['difference', 'dad', 'jokes', 'kid', 'jokes', 'Kid', 'jokes', 'obvious', 'punchlines', 'dad', 'jokes', 'parent']",12,1,difference dad jokes kid jokes kid jokes obvious punchlines dad jokes parent 
1404,My uncle Gary would always said hay was for horses. When I was a little kid anytime some one would get me mad I would say “HEY!” Well my uncle Gary would always replay with “Hay is for horses” I can’t tell you how mad I would get after lol.,"['My', 'uncle', 'Gary', 'would', 'always', 'said', 'hay', 'horses', 'When', 'I', 'little', 'kid', 'anytime', 'one', 'would', 'get', 'mad', 'I', 'would', 'say', 'HEY', 'Well', 'uncle', 'Gary', 'would', 'always', 'replay', 'Hay', 'horses', 'I', 'tell', 'mad', 'I', 'would', 'get', 'lol']",36,1,my uncle gary would always said hay horses when i little kid anytime one would get mad i would say hey well uncle gary would always replay hay horses i tell mad i would get lol 
1405,"Two chemists walk into a bar. The first one says, ""I'll have some H2O."" The second says, ""I'll have some water too. But why'd you order it like that? We aren't at work."" The first﻿ chemist excuses himself and weeps in the bathroom. His assassination plot had failed.","['Two', 'chemists', 'walk', 'bar', 'The', 'first', 'one', 'says', 'I', 'H2O', 'The', 'second', 'says', 'I', 'water', 'But', 'order', 'like', 'We', 'work', 'The', 'first', 'chemist', 'excuses', 'weeps', 'bathroom', 'His', 'assassination', 'plot', 'failed']",29,1,two chemists walk bar the first one says i h2o the second says i water but order like we work the first chemist excuses weeps bathroom his assassination plot failed 
1406,what do you call someone who loves novels? An afictionado.,"['call', 'someone', 'loves', 'novels', 'An', 'afictionado']",6,1,call someone loves novels an afictionado 
1407,Have you heard the music of Pelvis Presley? He's hip.,"['Have', 'heard', 'music', 'Pelvis', 'Presley', 'He', 'hip']",7,0,have heard music pelvis presley he hip 
1408,I know how I’m serving Christmas brunch this year!,"['I', 'know', 'I', 'serving', 'Christmas', 'brunch', 'year']",7,0,i know i serving christmas brunch year 
1409,Just made a post about my infection on social media. Just found out it's viral.,"['Just', 'made', 'post', 'infection', 'social', 'media', 'Just', 'found', 'viral']",9,0,just made post infection social media just found viral 
1410,"The biggest towel is called the ""Monster Towel"" You should call it the Eiffel Towel.","['The', 'biggest', 'towel', 'called', 'Monster', 'Towel', 'You', 'call', 'Eiffel', 'Towel']",10,0,the biggest towel called monster towel you call eiffel towel 
1411,Why did Chipotle hire eminem? Because he was a Wrap God.,"['Why', 'Chipotle', 'hire', 'eminem', 'Because', 'Wrap', 'God']",7,1,why chipotle hire eminem because wrap god 
1412,Bad chuck Norris chocolate joke. Chocolate cream.,"['Bad', 'chuck', 'Norris', 'chocolate', 'joke', 'Chocolate', 'cream']",7,0,bad chuck norris chocolate joke chocolate cream 
1413,Spotify is a bad app!,"['Spotify', 'bad', 'app']",3,0,spotify bad app 
1414,Snow joke. sNOW is so demanding.,"['Snow', 'joke', 'sNOW', 'demanding']",4,0,snow joke snow demanding 
1415,What do you call a dog with spots? A **good dog**,"['What', 'call', 'dog', 'spots', 'A', 'good', 'dog']",7,0,what call dog spots a good dog 
1416,What is it called when you get a boner at a funeral? Mourning Wood.,"['What', 'called', 'get', 'boner', 'funeral', 'Mourning', 'Wood']",7,0,what called get boner funeral mourning wood 
1417,Poor iPad.,"['Poor', 'iPad']",2,0,poor ipad 
1418,Why did Hillary Clinton lose in 2016? Because she failed to realize that her husband's Wiener wasn't the only Wiener that she needed to worry about!,"['Why', 'Hillary', 'Clinton', 'lose', '2016', 'Because', 'failed', 'realize', 'husband', 'Wiener', 'Wiener', 'needed', 'worry']",12,0,why hillary clinton lose 2016 because failed realize husband wiener wiener needed worry 
1419,My friends without kids never get any of my dad jokes. They're not apparent.,"['My', 'friends', 'without', 'kids', 'never', 'get', 'dad', 'jokes', 'They', 'apparent']",10,1,my friends without kids never get dad jokes they apparent 
1420,What did the Flower ask the Bee? Is that your stinger showing or are you just happy to see me?,"['What', 'Flower', 'ask', 'Bee', 'Is', 'stinger', 'showing', 'happy', 'see']",9,0,what flower ask bee is stinger showing happy see 
1421,"Did you see the guy who tried to marry a box of Eggos? Yeah, he wanted to make it his waffley wedded wife.","['Did', 'see', 'guy', 'tried', 'marry', 'box', 'Eggos', 'Yeah', 'wanted', 'make', 'waffley', 'wedded', 'wife']",13,1,did see guy tried marry box eggos yeah wanted make waffley wedded wife 
1422,What do you call a small Asian Imperial attack vessel? A Thai fighter.,"['What', 'call', 'small', 'Asian', 'Imperial', 'attack', 'vessel', 'A', 'Thai', 'fighter']",10,0,what call small asian imperial attack vessel a thai fighter 
1423,"In memoriam. Rapid Roy was a daredevil who specialized in car stunts. He decided to retire in style and end his career by attempting a canyon jump in the worst car he could find. After doing some digging, he came across a Chevy Nova in an auction in Champagne, LA. It was in bad shape, but he took a chance, won the bid, and spent several months doing body work and souping the engine up until it was as good as anything he’d jumped in before. Tragedy struck on the day of the jump, though. The engine suddenly failed just as Roy was leaving the ramp, and the car lost distance, slammed into the opposite wall of the canyon, and plummeted to the ground. Not only was it pancaked by the fall, it was further crushed by rocks dislodged by the initial impact. Roy was thusly immortalized in the local paper: Caught beneath the landslide In a Champagne super Nova in the sky.","['In', 'memoriam', 'Rapid', 'Roy', 'daredevil', 'specialized', 'car', 'stunts', 'He', 'decided', 'retire', 'style', 'end', 'career', 'attempting', 'canyon', 'jump', 'worst', 'car', 'could', 'find', 'After', 'digging', 'came', 'across', 'Chevy', 'Nova', 'auction', 'Champagne', 'LA', 'It', 'bad', 'shape', 'took', 'chance', 'bid', 'spent', 'several', 'months', 'body', 'work', 'souping', 'engine', 'good', 'anything', 'jumped', 'Tragedy', 'struck', 'day', 'jump', 'though', 'The', 'engine', 'suddenly', 'failed', 'Roy', 'leaving', 'ramp', 'car', 'lost', 'distance', 'slammed', 'opposite', 'wall', 'canyon', 'plummeted', 'ground', 'Not', 'pancaked', 'fall', 'crushed', 'rocks', 'dislodged', 'initial', 'impact', 'Roy', 'thusly', 'immortalized', 'local', 'paper', 'Caught', 'beneath', 'landslide', 'In', 'Champagne', 'super', 'Nova', 'sky']",88,0,in memoriam rapid roy daredevil specialized car stunts he decided retire style end career attempting canyon jump worst car could find after digging came across chevy nova auction champagne la it bad shape took chance bid spent several months body work souping engine good anything jumped tragedy struck day jump though the engine suddenly failed roy leaving ramp car lost distance slammed opposite wall canyon plummeted ground not pancaked fall crushed rocks dislodged initial impact roy thusly immortalized local paper caught beneath landslide in champagne super nova sky 
1424,If Cardi B had applied herself a little more in school... she'd be Cardi A+,"['If', 'Cardi', 'B', 'applied', 'little', 'school', 'Cardi', 'A']",8,1,if cardi b applied little school cardi a 
1425,Why don't we inhabit Uranus? That place is a Gas Hole.,"['Why', 'inhabit', 'Uranus', 'That', 'place', 'Gas', 'Hole']",7,1,why inhabit uranus that place gas hole 
1426,"I used to work at a can crushing facility, but I quit. It was soda pressing.","['I', 'used', 'work', 'crushing', 'facility', 'I', 'quit', 'It', 'soda', 'pressing']",10,1,i used work crushing facility i quit it soda pressing 
1427,"A doctor was inspecting the scalp of a boy with a bad case of lice. He explained to the worried mother, “The legs of these lice have sprouted into root-like structures beneath the scalp. Once this happens, it’s very difficult to extract them.” “Root-like structures? How is that possible?” she replied. “Well,” replied the doctor, “these are Grootinous lice.”","['A', 'doctor', 'inspecting', 'scalp', 'boy', 'bad', 'case', 'lice', 'He', 'explained', 'worried', 'mother', 'The', 'legs', 'lice', 'sprouted', 'root', 'like', 'structures', 'beneath', 'scalp', 'Once', 'happens', 'difficult', 'extract', 'Root', 'like', 'structures', 'How', 'possible', 'replied', 'Well', 'replied', 'doctor', 'Grootinous', 'lice']",36,1,a doctor inspecting scalp boy bad case lice he explained worried mother the legs lice sprouted root like structures beneath scalp once happens difficult extract root like structures how possible replied well replied doctor grootinous lice 
1428,What do you call someone who picks on people after they get to know them? A knows-picker.,"['What', 'call', 'someone', 'picks', 'people', 'get', 'know', 'A', 'knows', 'picker']",10,1,what call someone picks people get know a knows picker 
1429,What's Devo's favorite dog breed? Whippet.,"['What', 'Devo', 'favorite', 'dog', 'breed', 'Whippet']",6,0,what devo favorite dog breed whippet 
1430,I maintain my dad bod by procrastinating going to the gym. I call it wait lifting.,"['I', 'maintain', 'dad', 'bod', 'procrastinating', 'going', 'gym', 'I', 'call', 'wait', 'lifting']",11,1,i maintain dad bod procrastinating going gym i call wait lifting 
1431,Monokuma.. Stereokuma..,"['Monokuma', 'Stereokuma']",2,0,monokuma stereokuma 
1432,Q: What is the favorite drink of a miner? A: mineral water.,"['Q', 'What', 'favorite', 'drink', 'miner', 'A', 'mineral', 'water']",8,0,q what favorite drink miner a mineral water 
1433,"Its useless shutting down furniture establishments in scandanavia because customers are losing their hair. In other words, there's no point locking the table store when the norse has molted. (From the late great Tim Brooke-Taylor)","['Its', 'useless', 'shutting', 'furniture', 'establishments', 'scandanavia', 'customers', 'losing', 'hair', 'In', 'words', 'point', 'locking', 'table', 'store', 'norse', 'molted', 'From', 'late', 'great', 'Tim', 'Brooke', 'Taylor']",23,1,its useless shutting furniture establishments scandanavia customers losing hair in words point locking table store norse molted from late great tim brooke taylor 
1434,What do you say when someone makes an unexpected sex joke? Didn't see that cumming.,"['What', 'say', 'someone', 'makes', 'unexpected', 'sex', 'joke', 'Didn', 'see', 'cumming']",10,0,what say someone makes unexpected sex joke didn see cumming 
1435,"A man walked up to god and asked what his favorite social media was. God was about to answer, but as he was, he notices that a massive rock has collided into Earth and destroyed it without him noticing it's approach. God, distraught, said, ""My Space! Why?"" The man replied, ""No real reason, I was just curious.""","['A', 'man', 'walked', 'god', 'asked', 'favorite', 'social', 'media', 'God', 'answer', 'notices', 'massive', 'rock', 'collided', 'Earth', 'destroyed', 'without', 'noticing', 'approach', 'God', 'distraught', 'said', 'My', 'Space', 'Why', 'The', 'man', 'replied', 'No', 'real', 'reason', 'I', 'curious']",33,0,a man walked god asked favorite social media god answer notices massive rock collided earth destroyed without noticing approach god distraught said my space why the man replied no real reason i curious 
1436,I would never date a tennis player. Love means nothing to them.,"['I', 'would', 'never', 'date', 'tennis', 'player', 'Love', 'means', 'nothing']",9,1,i would never date tennis player love means nothing 
1437,I was shocked to find out how much my rich friend spent on buying a new toilet. He’s sitting on a small fortune.,"['I', 'shocked', 'find', 'much', 'rich', 'friend', 'spent', 'buying', 'new', 'toilet', 'He', 'sitting', 'small', 'fortune']",14,1,i shocked find much rich friend spent buying new toilet he sitting small fortune 
1438,Did anybody hear about the Johnny Depp case? Amber Heard.,"['Did', 'anybody', 'hear', 'Johnny', 'Depp', 'case', 'Amber', 'Heard']",8,1,did anybody hear johnny depp case amber heard 
1439,What do you call a homosexual female pig? A lesboporker!,"['What', 'call', 'homosexual', 'female', 'pig', 'A', 'lesboporker']",7,0,what call homosexual female pig a lesboporker 
1440,Browsing reddit is very...,"['Browsing', 'reddit']",2,0,browsing reddit 
1441,How do you undo a brainwashing? By getting it braindirty.,"['How', 'undo', 'brainwashing', 'By', 'getting', 'braindirty']",6,1,how undo brainwashing by getting braindirty 
1442,What's blue and smells like red paint? Blue paint.,"['What', 'blue', 'smells', 'like', 'red', 'paint', 'Blue', 'paint']",8,0,what blue smells like red paint blue paint 
1443,What fruit can play the guitar? Chuck berry.,"['What', 'fruit', 'play', 'guitar', 'Chuck', 'berry']",6,0,what fruit play guitar chuck berry 
1444,How do celestial bodies start getting ready for a party? They planet.,"['How', 'celestial', 'bodies', 'start', 'getting', 'ready', 'party', 'They', 'planet']",9,1,how celestial bodies start getting ready party they planet 
1445,"YEAAAAAAAAA. So a nun,pastor and a white man go into a brothel who got laid first Nunya damn business.","['YEAAAAAAAAA', 'So', 'nun', 'pastor', 'white', 'man', 'go', 'brothel', 'got', 'laid', 'first', 'Nunya', 'damn', 'business']",14,0,yeaaaaaaaaa so nun pastor white man go brothel got laid first nunya damn business 
1446,Browsing reddit is very...,"['Browsing', 'reddit']",2,0,browsing reddit 
1447,What do you call a moody Australian? Emu.,"['What', 'call', 'moody', 'Australian', 'Emu']",5,0,what call moody australian emu 
1448,Poker match:,"['Poker', 'match']",2,0,poker match 
1449,What did the DJ name his son? Eric.,"['What', 'DJ', 'name', 'son', 'Eric']",5,1,what dj name son eric 
1450,Today I finally read the birth certificate for my son. Son of a bitch!,"['Today', 'I', 'finally', 'read', 'birth', 'certificate', 'son', 'Son', 'bitch']",9,1,today i finally read birth certificate son son bitch 
1451,What's the difference between sailors and online watchdogs? Sailors worry about fishermen. Online watchdogs worry about phishermen.,"['What', 'difference', 'sailors', 'online', 'watchdogs', 'Sailors', 'worry', 'fishermen', 'Online', 'watchdogs', 'worry', 'phishermen']",12,0,what difference sailors online watchdogs sailors worry fishermen online watchdogs worry phishermen 
1452,What do you call an Italian spy? An Impasta.,"['What', 'call', 'Italian', 'spy', 'An', 'Impasta']",6,1,what call italian spy an impasta 
1453,What would Captain Ahab call himself if he was a country singer? Whalin' Jennings.,"['What', 'would', 'Captain', 'Ahab', 'call', 'country', 'singer', 'Whalin', 'Jennings']",9,0,what would captain ahab call country singer whalin jennings 
1454,I was in South America today. It was quite cold so I wore a coat to stop me from being chile.,"['I', 'South', 'America', 'today', 'It', 'quite', 'cold', 'I', 'wore', 'coat', 'stop', 'chile']",12,1,i south america today it quite cold i wore coat stop chile 
1455,"HAPPY MOTHER'S DAY. To the moms out there, all of your children... ...were born at womb temperature.","['HAPPY', 'MOTHER', 'S', 'DAY', 'To', 'moms', 'children', 'born', 'womb', 'temperature']",10,1,happy mother s day to moms children born womb temperature 
1456,"I know times are tough for a lot of people right now. All over the planet, humanity struggles with problems that seem to never go away... just remember, you can always rest assured that at the end of the day... ... it's night.","['I', 'know', 'times', 'tough', 'lot', 'people', 'right', 'All', 'planet', 'humanity', 'struggles', 'problems', 'seem', 'never', 'go', 'away', 'remember', 'always', 'rest', 'assured', 'end', 'day', 'night']",23,1,i know times tough lot people right all planet humanity struggles problems seem never go away remember always rest assured end day night 
1457,oh boy.,"['oh', 'boy']",2,0,oh boy 
1458,Someone complimented my parking today! They left a sweet note on my windshield that said “parking fine.”,"['Someone', 'complimented', 'parking', 'today', 'They', 'left', 'sweet', 'note', 'windshield', 'said', 'parking', 'fine']",12,1,someone complimented parking today they left sweet note windshield said parking fine 
