,joke,tokens,token_count,funny,clean_text
673,"A guy walks into a bar. A guy walks into a bar and orders a beer. ""I finally published a book of all the dumb jokes people come in here and tell me,"" the bartender says. ""Is it any good?"" the guy asks. ""Well I showed it to some customers last night and I had them falling out of their chairs,"" the bartender brags. ""It's that good?"" the guy asks. ""No, they hated it,"" the bartender replies. ""So I pushed them off their bar stools."" **Share**","['A', 'guy', 'walks', 'bar', 'A', 'guy', 'walks', 'bar', 'orders', 'beer', 'I', 'finally', 'published', 'book', 'dumb', 'jokes', 'people', 'come', 'tell', 'bartender', 'says', 'Is', 'good', 'guy', 'asks', 'Well', 'I', 'showed', 'customers', 'last', 'night', 'I', 'falling', 'chairs', 'bartender', 'brags', 'It', 'good', 'guy', 'asks', 'No', 'hated', 'bartender', 'replies', 'So', 'I', 'pushed', 'bar', 'stools', 'Share']",50,1,a guy walks bar a guy walks bar orders beer i finally published book dumb jokes people come tell bartender says is good guy asks well i showed customers last night i falling chairs bartender brags it good guy asks no hated bartender replies so i pushed bar stools share 
674,Why did the broccoli slap the lettuce? It was being fresh.,"['Why', 'broccoli', 'slap', 'lettuce', 'It', 'fresh']",6,0,why broccoli slap lettuce it fresh 
675,What does a robot lumberjack say when he chops down a tree? TIM-BORG.,"['What', 'robot', 'lumberjack', 'say', 'chops', 'tree', 'TIM', 'BORG']",8,0,what robot lumberjack say chops tree tim borg 
676,"If Snoop Dogg were an actual dog, what breed would he be? Labradizzle.","['If', 'Snoop', 'Dogg', 'actual', 'dog', 'breed', 'would', 'Labradizzle']",8,1,if snoop dogg actual dog breed would labradizzle 
677,What's an autistic person's favorite food? Ass burgers.,"['What', 'autistic', 'person', 'favorite', 'food', 'Ass', 'burgers']",7,0,what autistic person favorite food ass burgers 
678,I heard counterfeit money is a huge problem. So I made my own money to make sure it’s real.,"['I', 'heard', 'counterfeit', 'money', 'huge', 'problem', 'So', 'I', 'made', 'money', 'make', 'sure', 'real']",13,1,i heard counterfeit money huge problem so i made money make sure real 
679,How many potatoes does it take to kill an Irish man? None. None at all.,"['How', 'many', 'potatoes', 'take', 'kill', 'Irish', 'man', 'None', 'None']",9,0,how many potatoes take kill irish man none none 
680,"My wife wanted to have sex at the Texas border with me on the Texas side. I asked her why Her response: ""Everything's bigger in Texas""","['My', 'wife', 'wanted', 'sex', 'Texas', 'border', 'Texas', 'side', 'I', 'asked', 'Her', 'response', 'Everything', 'bigger', 'Texas']",15,1,my wife wanted sex texas border texas side i asked her response everything bigger texas 
681,"I had commissioned a sculptor to make a full body statue of me, but they ended up only getting my head. I guess it was all just a bust.","['I', 'commissioned', 'sculptor', 'make', 'full', 'body', 'statue', 'ended', 'getting', 'head', 'I', 'guess', 'bust']",13,1,i commissioned sculptor make full body statue ended getting head i guess bust 
682,Guess what I saw at Arabia. I Saudi Arabia.,"['Guess', 'I', 'saw', 'Arabia', 'I', 'Saudi', 'Arabia']",7,0,guess i saw arabia i saudi arabia 
683,French people don’t masturbate … They jacques off.,"['French', 'people', 'masturbate', 'They', 'jacques']",5,1,french people masturbate they jacques 
684,What's a candle's favorite Keanu Reeves movie? John Wick.,"['What', 'candle', 'favorite', 'Keanu', 'Reeves', 'movie', 'John', 'Wick']",8,0,what candle favorite keanu reeves movie john wick 
685,"I can't believe it you're always carrying too much weight, letting others look you up and down, and break no matter how much effort I put in... Sorry I'm just criticizing myshelf.","['I', 'believe', 'always', 'carrying', 'much', 'weight', 'letting', 'others', 'look', 'break', 'matter', 'much', 'effort', 'I', 'put', 'Sorry', 'I', 'criticizing', 'myshelf']",19,1,i believe always carrying much weight letting others look break matter much effort i put sorry i criticizing myshelf 
686,why did the walrus go to the Tupperware party? To find a tight seal.,"['walrus', 'go', 'Tupperware', 'party', 'To', 'find', 'tight', 'seal']",8,1,walrus go tupperware party to find tight seal 
687,Which Canadian province has the most dogs in it? Newfoundland and Labrador.,"['Which', 'Canadian', 'province', 'dogs', 'Newfoundland', 'Labrador']",6,1,which canadian province dogs newfoundland labrador 
688,sure is chilly out here... wish it was minestrone...but it's chilly Wish it was jalapeno...but it's chilly Wish it was Argentina... but it's chilly.,"['sure', 'chilly', 'wish', 'minestrone', 'chilly', 'Wish', 'jalapeno', 'chilly', 'Wish', 'Argentina', 'chilly']",11,1,sure chilly wish minestrone chilly wish jalapeno chilly wish argentina chilly 
689,I like mountains. But volcanoes are ash holes.,"['I', 'like', 'mountains', 'But', 'volcanoes', 'ash', 'holes']",7,0,i like mountains but volcanoes ash holes 
690,I got fired from my job as a taxi driver. Apperently people dont like it when you go the extra mile for them.,"['I', 'got', 'fired', 'job', 'taxi', 'driver', 'Apperently', 'people', 'dont', 'like', 'go', 'extra', 'mile']",13,1,i got fired job taxi driver apperently people dont like go extra mile 
691,Knock knock. Who’s there? Lettuce. Lettuce who? Lettuce in.,"['Knock', 'knock', 'Who', 'Lettuce', 'Lettuce', 'Lettuce']",6,0,knock knock who lettuce lettuce lettuce 
692,Mother’s Day always makes me miss my dad. Before he died he spent his entire life fighting for women’s rights. Mom wanted to get involved too but he said her place was at home with us kids.,"['Mother', 'Day', 'always', 'makes', 'miss', 'dad', 'Before', 'died', 'spent', 'entire', 'life', 'fighting', 'women', 'rights', 'Mom', 'wanted', 'get', 'involved', 'said', 'place', 'home', 'us', 'kids']",23,1,mother day always makes miss dad before died spent entire life fighting women rights mom wanted get involved said place home us kids 
693,I saw a pregnant horse muttering incantations with her friends... Thus a cult was born.,"['I', 'saw', 'pregnant', 'horse', 'muttering', 'incantations', 'friends', 'Thus', 'cult', 'born']",10,1,i saw pregnant horse muttering incantations friends thus cult born 
694,The only extreme sport. The only extreme sport I do is not doing my homework and hoping I get a snow day tomorrow.,"['The', 'extreme', 'sport', 'The', 'extreme', 'sport', 'I', 'homework', 'hoping', 'I', 'get', 'snow', 'day', 'tomorrow']",14,0,the extreme sport the extreme sport i homework hoping i get snow day tomorrow 
695,"How does a mathemagician disappear? He goes ""proof""!","['How', 'mathemagician', 'disappear', 'He', 'goes', 'proof']",6,1,how mathemagician disappear he goes proof 
696,I've been stocking up on food lately. You know why? Because I can.,"['I', 'stocking', 'food', 'lately', 'You', 'know', 'Because', 'I']",8,0,i stocking food lately you know because i 
697,Why are public defenders always U2 fans? Because all of their work is pro Bono.,"['Why', 'public', 'defenders', 'always', 'U2', 'fans', 'Because', 'work', 'pro', 'Bono']",9,1,why public defenders always u2 fans because work pro bono 
698,Why was the bird president impeached? He was accused of quid pro crow.,"['Why', 'bird', 'president', 'impeached', 'He', 'accused', 'quid', 'pro', 'crow']",9,0,why bird president impeached he accused quid pro crow 
699,I made a Noah schnapp joke. What do you get if you take away the first two letters of Noah Schnapp? Ah Schnapp! ( it’s bad but it made my sister disown me so :) ),"['I', 'made', 'Noah', 'schnapp', 'joke', 'What', 'get', 'take', 'away', 'first', 'two', 'letters', 'Noah', 'Schnapp', 'Ah', 'Schnapp', 'bad', 'made', 'sister', 'disown']",20,0,i made noah schnapp joke what get take away first two letters noah schnapp ah schnapp bad made sister disown 
700,I have just broken up with gym. I guess you could say it didnt workout.,"['I', 'broken', 'gym', 'I', 'guess', 'could', 'say', 'didnt', 'workout']",9,0,i broken gym i guess could say didnt workout 
701,"I took my worst enemy out to dinner at a steakhouse to try to reconcile our differences. When we ordered the same thing, I thought we were seeing eye to eye, but he still had beef with me.","['I', 'took', 'worst', 'enemy', 'dinner', 'steakhouse', 'try', 'reconcile', 'differences', 'When', 'ordered', 'thing', 'I', 'thought', 'seeing', 'eye', 'eye', 'still', 'beef']",19,1,i took worst enemy dinner steakhouse try reconcile differences when ordered thing i thought seeing eye eye still beef 
702,Melons. When life gives you melons Your dyslexic.,"['Melons', 'When', 'life', 'gives', 'melons', 'Your', 'dyslexic']",7,0,melons when life gives melons your dyslexic 
703,A man in crutches wearing camouflage stole my phone... You can hide but you can't run.,"['A', 'man', 'crutches', 'wearing', 'camouflage', 'stole', 'phone', 'You', 'hide', 'run']",10,0,a man crutches wearing camouflage stole phone you hide run 
704,"my dad just made a joke when my mom fell asleep with her glasses on: ""It's so she can see her dreams more clearly""","['dad', 'made', 'joke', 'mom', 'fell', 'asleep', 'glasses', 'It', 'see', 'dreams', 'clearly']",11,1,dad made joke mom fell asleep glasses it see dreams clearly 
705,Did you know every smartphone has a Jedi power? Force Stop.,"['Did', 'know', 'every', 'smartphone', 'Jedi', 'power', 'Force', 'Stop']",8,1,did know every smartphone jedi power force stop 
706,Plz delete this mods. We should all do the demolition man gighfive so we don't touch eachother.,"['Plz', 'delete', 'mods', 'We', 'demolition', 'man', 'gighfive', 'touch', 'eachother']",9,0,plz delete mods we demolition man gighfive touch eachother 
707,How many surrealists does it take to screw in a lightbulb? Purple!,"['How', 'many', 'surrealists', 'take', 'screw', 'lightbulb', 'Purple']",7,0,how many surrealists take screw lightbulb purple 
708,"I bought a radio for $5. The volume knob was stuck on high, but I thought to myself. I just can't turn that down.","['I', 'bought', 'radio', '5', 'The', 'volume', 'knob', 'stuck', 'high', 'I', 'thought', 'I', 'turn']",12,1,i bought radio 5 the volume knob stuck high i thought i turn 
709,"A good bad joke. Friend: hey how tall are you Me: 6,4"" Friend: *screams* Me: i might be 6,5"" Friend: *screams* Me: bro why you screaming? Friend: sorry, im scared of heights.","['A', 'good', 'bad', 'joke', 'Friend', 'hey', 'tall', 'Me', '6', '4', 'Friend', 'screams', 'Me', 'might', '6', '5', 'Friend', 'screams', 'Me', 'bro', 'screaming', 'Friend', 'sorry', 'im', 'scared', 'heights']",22,0,a good bad joke friend hey tall me 6 4 friend screams me might 6 5 friend screams me bro screaming friend sorry im scared heights 
710,What’s Italian’s favorite cheese? They like-a goud-a cheese of course!,"['What', 'Italian', 'favorite', 'cheese', 'They', 'like', 'goud', 'cheese', 'course']",9,1,what italian favorite cheese they like goud cheese course 
711,"How Do You Make A Kleenex Dance? You put a little ""boogie"" in it.","['How', 'Do', 'You', 'Make', 'A', 'Kleenex', 'Dance', 'You', 'put', 'little', 'boogie']",11,1,how do you make a kleenex dance you put little boogie 
712,"Okay. Tell me if anyone gets this joke, “two bears are in a rowboat in the middle of the desert. The first bear looks at the second bear and says ‘where’s your paddle?’ The second bear looks back and says ‘sure does!’”","['Okay', 'Tell', 'anyone', 'gets', 'joke', 'two', 'bears', 'rowboat', 'middle', 'desert', 'The', 'first', 'bear', 'looks', 'second', 'bear', 'says', 'paddle', 'The', 'second', 'bear', 'looks', 'back', 'says', 'sure']",25,0,okay tell anyone gets joke two bears rowboat middle desert the first bear looks second bear says paddle the second bear looks back says sure 
713,I've decided to name one of my wisdom teeth Roosevelt. Because Roosevelt made the Panama Root Canal.,"['I', 'decided', 'name', 'one', 'wisdom', 'teeth', 'Roosevelt', 'Because', 'Roosevelt', 'made', 'Panama', 'Root', 'Canal']",13,1,i decided name one wisdom teeth roosevelt because roosevelt made panama root canal 
714,"A truck filled with Thesauruses crashed on the highway today and its contents were scattered everywhere. Witnesses were left baffled, perplexed, puzzled, bewildered, mystified, bemused, confused, confounded, disconcerted, discombobulated, fazed...","['A', 'truck', 'filled', 'Thesauruses', 'crashed', 'highway', 'today', 'contents', 'scattered', 'everywhere', 'Witnesses', 'left', 'baffled', 'perplexed', 'puzzled', 'bewildered', 'mystified', 'bemused', 'confused', 'confounded', 'disconcerted', 'discombobulated', 'fazed']",23,1,a truck filled thesauruses crashed highway today contents scattered everywhere witnesses left baffled perplexed puzzled bewildered mystified bemused confused confounded disconcerted discombobulated fazed 
715,I know a cool joke about indices; but I'm 2² to say it.,"['I', 'know', 'cool', 'joke', 'indices', 'I', '2²', 'say']",7,0,i know cool joke indices i 2² say 
716,what do you call a horse and a bee that live in the same neighborhood? Neigh-buzz.,"['call', 'horse', 'bee', 'live', 'neighborhood', 'Neigh', 'buzz']",7,1,call horse bee live neighborhood neigh buzz 
717,Why did the giraffe teen get in trouble? Her parents caught her necking with her boyfriend.,"['Why', 'giraffe', 'teen', 'get', 'trouble', 'Her', 'parents', 'caught', 'necking', 'boyfriend']",10,0,why giraffe teen get trouble her parents caught necking boyfriend 
718,How do you kill a vegan vampire? Drive a steak through its heart.,"['How', 'kill', 'vegan', 'vampire', 'Drive', 'steak', 'heart']",7,0,how kill vegan vampire drive steak heart 
719,"Last night, my wife and I were getting ready to go out for an anniversary dinner. After finishing getting ready, my wife asked my 9 year old, ""how do I look?"" My daughter deadpanned response: ""with your eyes."" &amp;#x200B; I couldn't have asked for a better anniversary gift. #prouddadmoment.","['Last', 'night', 'wife', 'I', 'getting', 'ready', 'go', 'anniversary', 'dinner', 'After', 'finishing', 'getting', 'ready', 'wife', 'asked', '9', 'year', 'old', 'I', 'look', 'My', 'daughter', 'deadpanned', 'response', 'eyes', 'amp', 'x200B', 'I', 'asked', 'better', 'anniversary', 'gift', 'prouddadmoment']",31,1,last night wife i getting ready go anniversary dinner after finishing getting ready wife asked 9 year old i look my daughter deadpanned response eyes amp x200b i asked better anniversary gift prouddadmoment 
720,David hasslehoff changed his name to the hoff. Apparently it wasn’t worth the hassle.,"['David', 'hasslehoff', 'changed', 'name', 'hoff', 'Apparently', 'worth', 'hassle']",8,1,david hasslehoff changed name hoff apparently worth hassle 
721,What do you call a teenager who regularly thickens sauces? A roux teen.,"['What', 'call', 'teenager', 'regularly', 'thickens', 'sauces', 'A', 'roux', 'teen']",9,0,what call teenager regularly thickens sauces a roux teen 
722,What do you say to a cookie when you want to be left alone? “Bisc-off!”,"['What', 'say', 'cookie', 'want', 'left', 'alone', 'Bisc']",7,1,what say cookie want left alone bisc 
723,Why did the window go to the hospital? He had pane.,"['Why', 'window', 'go', 'hospital', 'He', 'pane']",6,0,why window go hospital he pane 
724,What do you call a fish with no eyes? Fsh.,"['What', 'call', 'fish', 'eyes', 'Fsh']",5,0,what call fish eyes fsh 
725,I once had a girlfriend with a talking parrot. The stupid thing wouldn’t shut up. But the bird was cool.,"['I', 'girlfriend', 'talking', 'parrot', 'The', 'stupid', 'thing', 'shut', 'But', 'bird', 'cool']",11,1,i girlfriend talking parrot the stupid thing shut but bird cool 
726,"Yoda's mama (Yomama) is so fat... He says: ""Arrive home, her bellybutton does, 15 minutes before she will.""","['Yoda', 'mama', 'Yomama', 'fat', 'He', 'says', 'Arrive', 'home', 'bellybutton', '15', 'minutes']",10,1,yoda mama yomama fat he says arrive home bellybutton 15 minutes 
727,What do you call a fish with a bow tie? So-fish-ticated.,"['What', 'call', 'fish', 'bow', 'tie', 'So', 'fish', 'ticated']",8,1,what call fish bow tie so fish ticated 
728,What's the most popular Patsy Cline song in China? Wokking After Midnight.,"['What', 'popular', 'Patsy', 'Cline', 'song', 'China', 'Wokking', 'After', 'Midnight']",9,0,what popular patsy cline song china wokking after midnight 
729,How do you spot a sexy Muslim girl? She has a hijab on for Allah and her ass out for Abdullah!,"['How', 'spot', 'sexy', 'Muslim', 'girl', 'She', 'hijab', 'Allah', 'ass', 'Abdullah']",10,0,how spot sexy muslim girl she hijab allah ass abdullah 
730,What do call a navy officer that blogs? A ship-poster.,"['What', 'call', 'navy', 'officer', 'blogs', 'A', 'ship', 'poster']",8,1,what call navy officer blogs a ship poster 
731,It's Star Wars Day and I'm still single. I've been looking for love in Alderaan places.,"['It', 'Star', 'Wars', 'Day', 'I', 'still', 'single', 'I', 'looking', 'love', 'Alderaan', 'places']",12,1,it star wars day i still single i looking love alderaan places 
732,What does the peasant duck say to the king duck? “Ma’ llard”,"['What', 'peasant', 'duck', 'say', 'king', 'duck', 'Ma', 'llard']",8,0,what peasant duck say king duck ma llard 
733,game cube.,"['game', 'cube']",2,0,game cube 
734,What's it called when you use peanut butter instead of KY? Jiffy Lube.,"['What', 'called', 'use', 'peanut', 'butter', 'instead', 'KY', 'Jiffy', 'Lube']",9,0,what called use peanut butter instead ky jiffy lube 
735,"What did the Mandalorian say when he was teaching how to make cheese? ""This is the whey.""","['What', 'Mandalorian', 'say', 'teaching', 'make', 'cheese', 'This', 'whey']",8,0,what mandalorian say teaching make cheese this whey 
736,Petition: Let's start calling hot-dogs tubey boys. sorry lol.,"['Petition', 'Let', 'start', 'calling', 'hot', 'dogs', 'tubey', 'boys', 'sorry', 'lol']",10,0,petition let start calling hot dogs tubey boys sorry lol 
737,Have you heard about the chocolate record player? It sounds pretty sweet.,"['Have', 'heard', 'chocolate', 'record', 'player', 'It', 'sounds', 'pretty', 'sweet']",9,1,have heard chocolate record player it sounds pretty sweet 
738,My friend got engaged over the phone. He says he just had to ring her.,"['My', 'friend', 'got', 'engaged', 'phone', 'He', 'says', 'ring']",8,1,my friend got engaged phone he says ring 
739,"The Wishing Well. There were two men. One of them starts walking forward judgingly towards the another. ""Well, well..."" he starts. The another interrupts ""Just toss me a coin instead, instead of repeatedly calling my name. I heard it works better with the wish granting.""","['The', 'Wishing', 'Well', 'There', 'two', 'men', 'One', 'starts', 'walking', 'forward', 'judgingly', 'towards', 'another', 'Well', 'well', 'starts', 'The', 'another', 'interrupts', 'Just', 'toss', 'coin', 'instead', 'instead', 'repeatedly', 'calling', 'name', 'I', 'heard', 'works', 'better', 'wish', 'granting']",33,0,the wishing well there two men one starts walking forward judgingly towards another well well starts the another interrupts just toss coin instead instead repeatedly calling name i heard works better wish granting 
740,What do you call a prostitute who works for a newspaper? A presstitute!,"['What', 'call', 'prostitute', 'works', 'newspaper', 'A', 'presstitute']",7,0,what call prostitute works newspaper a presstitute 
741,When Is A Door Not A Door? When it is ajar.,"['When', 'Is', 'A', 'Door', 'Not', 'A', 'Door', 'When', 'ajar']",9,1,when is a door not a door when ajar 
742,"If Captain Falcon were Polish, what item would he need to unlock the FALCON PONSCH move? The paczki. (Pronounced poontch-key, yes, this joke is that bad...)","['If', 'Captain', 'Falcon', 'Polish', 'item', 'would', 'need', 'unlock', 'FALCON', 'PONSCH', 'move', 'The', 'paczki', 'Pronounced', 'poontch', 'key', 'yes', 'joke', 'bad']",19,0,if captain falcon polish item would need unlock falcon ponsch move the paczki pronounced poontch key yes joke bad 
743,What do you call our saviour who only eats the outside of toast? Jesus CRUST!,"['What', 'call', 'saviour', 'eats', 'outside', 'toast', 'Jesus', 'CRUST']",8,1,what call saviour eats outside toast jesus crust 
744,Have you read the nutritional information on a box of Fruit Loops? You're better off eating the toucan.,"['Have', 'read', 'nutritional', 'information', 'box', 'Fruit', 'Loops', 'You', 'better', 'eating', 'toucan']",11,1,have read nutritional information box fruit loops you better eating toucan 
745,What do you call a clown that ecplodes when you step on it? A land mime.,"['What', 'call', 'clown', 'ecplodes', 'step', 'A', 'land', 'mime']",8,0,what call clown ecplodes step a land mime 
746,what did the NY theater's new ticket taker say to the playwright? Euripides?,"['NY', 'theater', 'new', 'ticket', 'taker', 'say', 'playwright', 'Euripides']",8,1,ny theater new ticket taker say playwright euripides 
747,"In high school, my science teacher made the best bad jokes. Here's one I've been laughing at for 17 years: Why was the peanut afraid to walk through the park? Because it was a salted.","['In', 'high', 'school', 'science', 'teacher', 'made', 'best', 'bad', 'jokes', 'Here', 'one', 'I', 'laughing', '17', 'years', 'Why', 'peanut', 'afraid', 'walk', 'park', 'Because', 'salted']",21,0,in high school science teacher made best bad jokes here one i laughing 17 years why peanut afraid walk park because salted 
748,Why do AC/DC fans like veal from Angus calves? Because it's Angus young.,"['Why', 'AC', 'DC', 'fans', 'like', 'veal', 'Angus', 'calves', 'Because', 'Angus', 'young']",11,0,why ac dc fans like veal angus calves because angus young 
749,"Turns out, a lot of bees would rather die than share their honey. Why are they so stingy?","['Turns', 'lot', 'bees', 'would', 'rather', 'die', 'share', 'honey', 'Why', 'stingy']",10,1,turns lot bees would rather die share honey why stingy 
750,There was a huge explosion at the cheese factory. They are still cleaning up debris.,"['There', 'huge', 'explosion', 'cheese', 'factory', 'They', 'still', 'cleaning', 'debris']",9,1,there huge explosion cheese factory they still cleaning debris 
751,Why should you stand in the corner when it’s cold? It’s 90 degrees (Not sure if this works better or worse if you’re using Celsius or Fahrenheit),"['Why', 'stand', 'corner', 'cold', 'It', '90', 'degrees', 'Not', 'sure', 'works', 'better', 'worse', 'using', 'Celsius', 'Fahrenheit']",14,1,why stand corner cold it 90 degrees not sure works better worse using celsius fahrenheit 
752,I came up with this at random. What do you call a sports drink made by the KKK? White Power-ade.,"['I', 'came', 'random', 'What', 'call', 'sports', 'drink', 'made', 'KKK', 'White', 'Power', 'ade']",12,0,i came random what call sports drink made kkk white power ade 
753,What is the name of Mario and Luigi's long lost broke brother. Welfario.,"['What', 'name', 'Mario', 'Luigi', 'long', 'lost', 'broke', 'brother', 'Welfario']",9,0,what name mario luigi long lost broke brother welfario 
754,What glue does an international spy use ? A BONDing agent.,"['What', 'glue', 'international', 'spy', 'use', 'A', 'BONDing', 'agent']",8,0,what glue international spy use a bonding agent 
755,Did you hear about the corvid-19 charity? All donations go to good caws.,"['Did', 'hear', 'corvid', '19', 'charity', 'All', 'donations', 'go', 'good', 'caws']",9,1,did hear corvid 19 charity all donations go good caws 
756,What is Tinker Bells's favorite band? The Pixies.,"['What', 'Tinker', 'Bells', 'favorite', 'band', 'The', 'Pixies']",7,0,what tinker bells favorite band the pixies 
757,What did Miss Piggy say after she was charged with domestic abuse. I did not kermit the crime.,"['What', 'Miss', 'Piggy', 'say', 'charged', 'domestic', 'abuse', 'I', 'kermit', 'crime']",10,0,what miss piggy say charged domestic abuse i kermit crime 
758,i don't even know what to say. Belly Eyelash-,"['even', 'know', 'say', 'Belly', 'Eyelash']",5,0,even know say belly eyelash 
759,What is the name of Mario and Luigi's long lost broke brother. Welfario.,"['What', 'name', 'Mario', 'Luigi', 'long', 'lost', 'broke', 'brother', 'Welfario']",9,0,what name mario luigi long lost broke brother welfario 
760,What do you do with an angry alien? Give him some space!,"['What', 'angry', 'alien', 'Give', 'space']",5,1,what angry alien give space 
761,"What do you get when you cross a mentally ill loner with society who treats them like trash? I’ll tell you what you get, YOU GET WHAT YOU FUCKING DESERVE.","['What', 'get', 'cross', 'mentally', 'ill', 'loner', 'society', 'treats', 'like', 'trash', 'I', 'tell', 'get', 'YOU', 'GET', 'WHAT', 'YOU', 'FUCKING', 'DESERVE']",19,0,what get cross mentally ill loner society treats like trash i tell get you get what you fucking deserve 
762,85% of Americans don’t know how to do basic math. Thank god I’m part of the other 25%,"['85', 'Americans', 'know', 'basic', 'math', 'Thank', 'god', 'I', 'part', '25']",8,1,85 americans know basic math thank god i part 25 
763,Why was the programmer arrested on charges of organ harvesting? ...He performed an illegal operation.,"['Why', 'programmer', 'arrested', 'charges', 'organ', 'harvesting', 'He', 'performed', 'illegal', 'operation']",10,0,why programmer arrested charges organ harvesting he performed illegal operation 
764,"What’s red looks like a yellow bucket, smells like a pink plastic bowl and feels like a green container? A red bucket.","['What', 'red', 'looks', 'like', 'yellow', 'bucket', 'smells', 'like', 'pink', 'plastic', 'bowl', 'feels', 'like', 'green', 'container', 'A', 'red', 'bucket']",18,1,what red looks like yellow bucket smells like pink plastic bowl feels like green container a red bucket 
