,joke,tokens,token_count,funny,clean_text
2132,why did the man throw the butter off the cliff. Because he wanted to see a butterfly....,"['man', 'throw', 'butter', 'cliff', 'Because', 'wanted', 'see', 'butterfly']",8,1,man throw butter cliff because wanted see butterfly 
2133,Did you hear about the couple who met at flight school? When they had kids they became helicopter parents.,"['Did', 'hear', 'couple', 'met', 'flight', 'school', 'When', 'kids', 'became', 'helicopter', 'parents']",11,0,did hear couple met flight school when kids became helicopter parents 
2134,"Knock, knock. Who's there? Eric Eric who? OH, my head. I think I have an eric.","['Knock', 'knock', 'Who', 'Eric', 'Eric', 'OH', 'head', 'I', 'think', 'I', 'eric']",11,1,knock knock who eric eric oh head i think i eric 
2135,"My gay friend walks in shirtless... so i tell him “hey, topless!” he looks surprised “how did you know we broke up?”","['My', 'gay', 'friend', 'walks', 'shirtless', 'tell', 'hey', 'topless', 'looks', 'surprised', 'know', 'broke']",12,0,my gay friend walks shirtless tell hey topless looks surprised know broke 
2136,What do you call a Swiss ion? A neutron.,"['What', 'call', 'Swiss', 'ion', 'A', 'neutron']",6,0,what call swiss ion a neutron 
2137,After listening to BB king all day I can now say. The thrill is gone.,"['After', 'listening', 'BB', 'king', 'day', 'I', 'say', 'The', 'thrill', 'gone']",10,1,after listening bb king day i say the thrill gone 
2138,I just went to an emotional wedding... Even the cake was in tiers.,"['I', 'went', 'emotional', 'wedding', 'Even', 'cake', 'tiers']",7,0,i went emotional wedding even cake tiers 
2139,I remember when my art teacher first showed me how to mix red and blue paints.. … I was purplexed!,"['I', 'remember', 'art', 'teacher', 'first', 'showed', 'mix', 'red', 'blue', 'paints', 'I', 'purplexed']",12,1,i remember art teacher first showed mix red blue paints i purplexed 
2140,What's the worst crime you can commit in a river? Grand Theft Otter.,"['What', 'worst', 'crime', 'commit', 'river', 'Grand', 'Theft', 'Otter']",8,0,what worst crime commit river grand theft otter 
2141,What did the Iranian leader do when he was told he was going to be killed? He ran.,"['What', 'Iranian', 'leader', 'told', 'going', 'killed', 'He', 'ran']",8,0,what iranian leader told going killed he ran 
2142,How is a sex fiend like a hearing impaired person? Come again?,"['How', 'sex', 'fiend', 'like', 'hearing', 'impaired', 'person', 'Come']",8,1,how sex fiend like hearing impaired person come 
2143,What's a ghost's favorite song? I Aint Got No Body.,"['What', 'ghost', 'favorite', 'song', 'I', 'Aint', 'Got', 'No', 'Body']",9,0,what ghost favorite song i aint got no body 
2144,I like mountains. But volcanoes are ash holes.,"['I', 'like', 'mountains', 'But', 'volcanoes', 'ash', 'holes']",7,0,i like mountains but volcanoes ash holes 
2145,Why were British bands in the sixties so trippy? Because they grew up using £sd.,"['Why', 'British', 'bands', 'sixties', 'trippy', 'Because', 'grew', 'using', 'sd']",9,1,why british bands sixties trippy because grew using sd 
2146,I cured my friend's constipation. I beat the shit out of him.,"['I', 'cured', 'friend', 'constipation', 'I', 'beat', 'shit']",7,0,i cured friend constipation i beat shit 
2147,"I just read the book ""No Man Is An Island"". By Archie Pelago.","['I', 'read', 'book', 'No', 'Man', 'Is', 'An', 'Island', 'By', 'Archie', 'Pelago']",11,1,i read book no man is an island by archie pelago 
2148,Even sponge bob no like.,"['Even', 'sponge', 'bob', 'like']",4,0,even sponge bob like 
2149,What's a vampire's favorite fruit? Blood oranges.,"['What', 'vampire', 'favorite', 'fruit', 'Blood', 'oranges']",6,0,what vampire favorite fruit blood oranges 
2150,What is a test that one would always be annoyed at? A cross-examination.,"['What', 'test', 'one', 'would', 'always', 'annoyed', 'A', 'cross', 'examination']",9,1,what test one would always annoyed a cross examination 
2151,Nice.,['Nice'],1,0,nice 
2152,What is Satan's favorite New York neighborhood? Hell's Kitchen.,"['What', 'Satan', 'favorite', 'New', 'York', 'neighborhood', 'Hell', 'Kitchen']",8,0,what satan favorite new york neighborhood hell kitchen 
2153,What’s the most grateful tower in all of Middle-earth? Orthank.,"['What', 'grateful', 'tower', 'Middle', 'earth', 'Orthank']",6,1,what grateful tower middle earth orthank 
2154,The flight crew on my flight looked scared when I announced that I eat pie lots...,"['The', 'flight', 'crew', 'flight', 'looked', 'scared', 'I', 'announced', 'I', 'eat', 'pie', 'lots']",12,0,the flight crew flight looked scared i announced i eat pie lots 
2155,My girlfriend broke up with me because I made too many Linkin Park references. But in the end it doesn’t even matter.,"['My', 'girlfriend', 'broke', 'I', 'made', 'many', 'Linkin', 'Park', 'references', 'But', 'end', 'even', 'matter']",13,1,my girlfriend broke i made many linkin park references but end even matter 
2156,My coworker only eats expired desserts for lunch. It's a little off pudding.,"['My', 'coworker', 'eats', 'expired', 'desserts', 'lunch', 'It', 'little', 'pudding']",9,1,my coworker eats expired desserts lunch it little pudding 
2157,All evidence collected to date points to the seamstress being the culprit... or sew it seams!,"['All', 'evidence', 'collected', 'date', 'points', 'seamstress', 'culprit', 'sew', 'seams']",9,1,all evidence collected date points seamstress culprit sew seams 
2158,How do you call the geometry of ionic lattices? Crystal Math.,"['How', 'call', 'geometry', 'ionic', 'lattices', 'Crystal', 'Math']",7,1,how call geometry ionic lattices crystal math 
2159,My favorite super hero is Typo Man. He writes all the wrongs.,"['My', 'favorite', 'super', 'hero', 'Typo', 'Man', 'He', 'writes', 'wrongs']",9,1,my favorite super hero typo man he writes wrongs 
2160,Where do you go after high school? Home.,"['Where', 'go', 'high', 'school', 'Home']",5,0,where go high school home 
2161,My boss asked me what happened to our manure. I told him I wasn’t t dealing with that crap.,"['My', 'boss', 'asked', 'happened', 'manure', 'I', 'told', 'I', 'dealing', 'crap']",10,1,my boss asked happened manure i told i dealing crap 
2162,What do you question yourself when your illiterate girl/boyfriend asks something dumb? Am I fucking stupid?,"['What', 'question', 'illiterate', 'girl', 'boyfriend', 'asks', 'something', 'dumb', 'Am', 'I', 'fucking', 'stupid']",12,0,what question illiterate girl boyfriend asks something dumb am i fucking stupid 
2163,"A snake walks into a bar. the bartender asks ""how did you do that?""","['A', 'snake', 'walks', 'bar', 'bartender', 'asks']",6,1,a snake walks bar bartender asks 
2164,What kind of food do they give slutty horses in Mexico? Whore Hay.,"['What', 'kind', 'food', 'give', 'slutty', 'horses', 'Mexico', 'Whore', 'Hay']",9,1,what kind food give slutty horses mexico whore hay 
2165,"""I wheeld the power of a car"" Tom said *tiredly* EXPLANATION: &gt;!This is a Tom Swifty mixed with a normal pun. It says ""wheeld"" instead of ""wield"", and ""tiredly"" alludes to a car, of course.!&lt;","['I', 'wheeld', 'power', 'car', 'Tom', 'said', 'tiredly', 'EXPLANATION', 'gt', 'This', 'Tom', 'Swifty', 'mixed', 'normal', 'pun', 'It', 'says', 'wheeld', 'instead', 'wield', 'tiredly', 'alludes', 'car', 'course', 'lt']",25,1,i wheeld power car tom said tiredly explanation gt this tom swifty mixed normal pun it says wheeld instead wield tiredly alludes car course lt 
2166,What do you call a genocide that was committed with laughing gas? A LOLocaust!,"['What', 'call', 'genocide', 'committed', 'laughing', 'gas', 'A', 'LOLocaust']",8,0,what call genocide committed laughing gas a lolocaust 
2167,Fart is invisible shit.,"['Fart', 'invisible', 'shit']",3,0,fart invisible shit 
2168,what looks like blue paint and smells like red paint.... well blue paint.,"['looks', 'like', 'blue', 'paint', 'smells', 'like', 'red', 'paint', 'well', 'blue', 'paint']",11,0,looks like blue paint smells like red paint well blue paint 
2169,My behind is broken. It’s got a crack in it!,"['My', 'behind', 'broken', 'It', 'got', 'crack']",6,1,my behind broken it got crack 
2170,What do you call a sad tale about a now defunct car company that sold endless money pits to their customers for decades? A Saab Story.,"['What', 'call', 'sad', 'tale', 'defunct', 'car', 'company', 'sold', 'endless', 'money', 'pits', 'customers', 'decades', 'A', 'Saab', 'Story']",16,0,what call sad tale defunct car company sold endless money pits customers decades a saab story 
2171,How do chemists travel? HeLiCoPtEr.,"['How', 'chemists', 'travel', 'HeLiCoPtEr']",4,1,how chemists travel helicopter 
2172,Which Roman emperor suffered from epilepsy? Seizure Augustus.,"['Which', 'Roman', 'emperor', 'suffered', 'epilepsy', 'Seizure', 'Augustus']",7,1,which roman emperor suffered epilepsy seizure augustus 
2173,why did the fence kill the man? He did it in self-de fence.,"['fence', 'kill', 'man', 'He', 'self', 'de', 'fence']",7,1,fence kill man he self de fence 
2174,"Yo mama's so dumb. When she heard that the Staples Center was called the house that Kobe built, she said, ""Was he a construction worker?""","['Yo', 'mama', 'dumb', 'When', 'heard', 'Staples', 'Center', 'called', 'house', 'Kobe', 'built', 'said', 'Was', 'construction', 'worker']",15,0,yo mama dumb when heard staples center called house kobe built said was construction worker 
2175,I got home from work the other day to find my daughter had left sugar on my bed. I guess she just wanted me to have sweet dreams.,"['I', 'got', 'home', 'work', 'day', 'find', 'daughter', 'left', 'sugar', 'bed', 'I', 'guess', 'wanted', 'sweet', 'dreams']",15,1,i got home work day find daughter left sugar bed i guess wanted sweet dreams 
2176,(Minor spoilers) I was wondering how the score would settle between the two Doctor Stranges would end... But I'm happy it ended on a happy note.,"['Minor', 'spoilers', 'I', 'wondering', 'score', 'would', 'settle', 'two', 'Doctor', 'Stranges', 'would', 'end', 'But', 'I', 'happy', 'ended', 'happy', 'note']",18,1,minor spoilers i wondering score would settle two doctor stranges would end but i happy ended happy note 
2177,What do you call a young wizard who doesn't shave? Hairy Potter.,"['What', 'call', 'young', 'wizard', 'shave', 'Hairy', 'Potter']",7,0,what call young wizard shave hairy potter 
2178,What do you call a beehive with no exit? Unbelievable.,"['What', 'call', 'beehive', 'exit', 'Unbelievable']",5,1,what call beehive exit unbelievable 
2179,What do you call valet superhero? Peter Parker.,"['What', 'call', 'valet', 'superhero', 'Peter', 'Parker']",6,1,what call valet superhero peter parker 
2180,wow so funny.,"['wow', 'funny']",2,0,wow funny 
2181,It's a bit late for a Star Wars Day joke but look. I am your father.,"['It', 'bit', 'late', 'Star', 'Wars', 'Day', 'joke', 'look', 'I', 'father']",10,1,it bit late star wars day joke look i father 
2182,My girlfriend and I broke up because she didn't like having a gun in our house. When I was leaving I said: You're gonna miss me when I'm gun.,"['My', 'girlfriend', 'I', 'broke', 'like', 'gun', 'house', 'When', 'I', 'leaving', 'I', 'said', 'You', 'gonna', 'miss', 'I', 'gun']",17,1,my girlfriend i broke like gun house when i leaving i said you gonna miss i gun 
2183,Have you heard the music of Pelvis Presley? He's hip.,"['Have', 'heard', 'music', 'Pelvis', 'Presley', 'He', 'hip']",7,0,have heard music pelvis presley he hip 
2184,Why do Boos keep inviting Mario's brother to haunted mansions? Because he has a Luigi Board.,"['Why', 'Boos', 'keep', 'inviting', 'Mario', 'brother', 'haunted', 'mansions', 'Because', 'Luigi', 'Board']",11,0,why boos keep inviting mario brother haunted mansions because luigi board 
2185,What's a Buddhist favourite cheese? Parma zen.,"['What', 'Buddhist', 'favourite', 'cheese', 'Parma', 'zen']",6,1,what buddhist favourite cheese parma zen 
2186,What change did Marge Simpson experience when she became a lesbian? She went from Homersexual to Homosexual!,"['What', 'change', 'Marge', 'Simpson', 'experience', 'became', 'lesbian', 'She', 'went', 'Homersexual', 'Homosexual']",11,0,what change marge simpson experience became lesbian she went homersexual homosexual 
2187,Just went into a store called I Love Nails. Turns out it is not a hardware store.,"['Just', 'went', 'store', 'called', 'I', 'Love', 'Nails', 'Turns', 'hardware', 'store']",10,1,just went store called i love nails turns hardware store 
2188,What do you call a city full of pigs? Porkopolis!,"['What', 'call', 'city', 'full', 'pigs', 'Porkopolis']",6,0,what call city full pigs porkopolis 
2189,"In high school, my science teacher made the best bad jokes. Here's one I've been laughing at for 17 years: Why was the peanut afraid to walk through the park? Because it was a salted.","['In', 'high', 'school', 'science', 'teacher', 'made', 'best', 'bad', 'jokes', 'Here', 'one', 'I', 'laughing', '17', 'years', 'Why', 'peanut', 'afraid', 'walk', 'park', 'Because', 'salted']",21,0,in high school science teacher made best bad jokes here one i laughing 17 years why peanut afraid walk park because salted 
2190,"The Greatest Pun of All Time. *This was an old joke I heard decades ago. Retold by my feeble memory.* There was a dad who came across a joke contest in a humor magazine, asking for the *Greatest Pun of All Time.* Priding himself on is ability to craft the wittiest puns, he decided to enter. In order to increase his odds, he stayed up, night after night, writing and rewriting pun after pun. Finally, he selected his 10 best jokes, and sent them in. A month later, when the new issue came out, he hurriedly turned to the results page. He was so certain that one of his jokes would win, but as it turned out, *no pun, in ten, did! (No pun intended.)*","['The', 'Greatest', 'Pun', 'All', 'Time', 'This', 'old', 'joke', 'I', 'heard', 'decades', 'ago', 'Retold', 'feeble', 'memory', 'There', 'dad', 'came', 'across', 'joke', 'contest', 'humor', 'magazine', 'asking', 'Greatest', 'Pun', 'All', 'Time', 'Priding', 'ability', 'craft', 'wittiest', 'puns', 'decided', 'enter', 'In', 'order', 'increase', 'odds', 'stayed', 'night', 'night', 'writing', 'rewriting', 'pun', 'pun', 'Finally', 'selected', '10', 'best', 'jokes', 'sent', 'A', 'month', 'later', 'new', 'issue', 'came', 'hurriedly', 'turned', 'results', 'page', 'He', 'certain', 'one', 'jokes', 'would', 'win', 'turned', 'pun', 'ten', 'No', 'pun', 'intended']",73,1,the greatest pun all time this old joke i heard decades ago retold feeble memory there dad came across joke contest humor magazine asking greatest pun all time priding ability craft wittiest puns decided enter in order increase odds stayed night night writing rewriting pun pun finally selected 10 best jokes sent a month later new issue came hurriedly turned results page he certain one jokes would win turned pun ten no pun intended 
2191,What do Fred Flintstone and Barney Rubble do when their wives are away? They have a gay old time.,"['What', 'Fred', 'Flintstone', 'Barney', 'Rubble', 'wives', 'away', 'They', 'gay', 'old', 'time']",11,0,what fred flintstone barney rubble wives away they gay old time 
2192,"I think that history is sexist. You might wonder, how the fuck is history sexist when it is just stuff that happened a long time ago? Well the name 'history' itself is sexist. WHY ISNT IT 'HERSTORY' ..","['I', 'think', 'history', 'sexist', 'You', 'might', 'wonder', 'fuck', 'history', 'sexist', 'stuff', 'happened', 'long', 'time', 'ago', 'Well', 'name', 'history', 'sexist', 'WHY', 'ISNT', 'IT', 'HERSTORY']",23,0,i think history sexist you might wonder fuck history sexist stuff happened long time ago well name history sexist why isnt it herstory 
2193,Some classicly cheesy car/automotive jokes. Source: [https://www.buffalocoresupply.com/blog/a-little-automotive-humor](https://www.buffalocoresupply.com/blog/a-little-automotive-humor) &amp;#x200B; what kind of cars do cats drive? catillacs. &amp;#x200B; why did the spider buy a sports car? so he could take it out for a spin. what happens to 13-year-old cars? they get car-mitzvahed. &amp;#x200B; when is a car not a car? when it turns into a driveway. what kind of cars do cooks drive? chef-rolets.,"['Some', 'classicly', 'cheesy', 'car', 'automotive', 'jokes', 'Source', 'https', 'www', 'buffalocoresupply', 'com', 'blog', 'little', 'automotive', 'humor', 'https', 'www', 'buffalocoresupply', 'com', 'blog', 'little', 'automotive', 'humor', 'amp', 'x200B', 'kind', 'cars', 'cats', 'drive', 'catillacs', 'amp', 'x200B', 'spider', 'buy', 'sports', 'car', 'could', 'take', 'spin', 'happens', '13', 'year', 'old', 'cars', 'get', 'car', 'mitzvahed', 'amp', 'x200B', 'car', 'car', 'turns', 'driveway', 'kind', 'cars', 'cooks', 'drive', 'chef', 'rolets']",55,0,some classicly cheesy car automotive jokes source https www buffalocoresupply com blog little automotive humor https www buffalocoresupply com blog little automotive humor amp x200b kind cars cats drive catillacs amp x200b spider buy sports car could take spin happens 13 year old cars get car mitzvahed amp x200b car car turns driveway kind cars cooks drive chef rolets 
2194,The Conductor.,"['The', 'Conductor']",2,0,the conductor 
2195,"Guys, I’m turning over a new leaf. I just crashed my electric Nissan I just bought.","['Guys', 'I', 'turning', 'new', 'leaf', 'I', 'crashed', 'electric', 'Nissan', 'I', 'bought']",11,1,guys i turning new leaf i crashed electric nissan i bought 
2196,"""That's a European starling...."" she said, pointing to the bird sitting on a trellis. 'As opposed to the Your-a-poopin kind'","['That', 'European', 'starling', 'said', 'pointing', 'bird', 'sitting', 'trellis', 'As', 'opposed', 'Your', 'poopin', 'kind']",13,1,that european starling said pointing bird sitting trellis as opposed your poopin kind 
2197,I’m not say’n things slow down after 50 but…. She asked me if I would like to have sex or take a nap. I said: Can you ask me when I wake up?,"['I', 'say', 'n', 'things', 'slow', '50', 'She', 'asked', 'I', 'would', 'like', 'sex', 'take', 'nap', 'I', 'said', 'Can', 'ask', 'I', 'wake']",19,1,i say n things slow 50 she asked i would like sex take nap i said can ask i wake 
2198,Where does Kim Kardashian get her plastic surgery? &amp;#x200B; Silicone Valley.,"['Where', 'Kim', 'Kardashian', 'get', 'plastic', 'surgery', 'amp', 'x200B', 'Silicone', 'Valley']",9,1,where kim kardashian get plastic surgery amp x200b silicone valley 
2199,a wheezer riddle. What has four letters Sometimes has nine But never has five.,"['wheezer', 'riddle', 'What', 'four', 'letters', 'Sometimes', 'nine', 'But', 'never', 'five']",10,1,wheezer riddle what four letters sometimes nine but never five 
2200,I went to a zoo the other day. All it had was just a single dog. It was a shitzu.,"['I', 'went', 'zoo', 'day', 'All', 'single', 'dog', 'It', 'shitzu']",9,0,i went zoo day all single dog it shitzu 
2201,I was printing some color photos when my printer stopped working. I was super surprised. It was completely out of the blue.,"['I', 'printing', 'color', 'photos', 'printer', 'stopped', 'working', 'I', 'super', 'surprised', 'It', 'completely', 'blue']",13,1,i printing color photos printer stopped working i super surprised it completely blue 
2202,Name the kind of tree you can hold in your hand? A palm tree.,"['Name', 'kind', 'tree', 'hold', 'hand', 'A', 'palm', 'tree']",8,1,name kind tree hold hand a palm tree 
2203,One for the old dads and grandpa's.,"['One', 'old', 'dads', 'grandpa']",4,1,one old dads grandpa 
2204,What do you call a physicist who also repairs Australian airplanes? A qantas mechanic.,"['What', 'call', 'physicist', 'also', 'repairs', 'Australian', 'airplanes', 'A', 'qantas', 'mechanic']",10,0,what call physicist also repairs australian airplanes a qantas mechanic 
2205,What do you call someone who has one night stands in gardens? A garden hoe.,"['What', 'call', 'someone', 'one', 'night', 'stands', 'gardens', 'A', 'garden', 'hoe']",10,0,what call someone one night stands gardens a garden hoe 
2206,When is the best day to cook? Friday.,"['When', 'best', 'day', 'cook', 'Friday']",5,0,when best day cook friday 
2207,What did the mario inspired Mayo scream when he hit his legs? Mayo-knees!!,"['What', 'mario', 'inspired', 'Mayo', 'scream', 'hit', 'legs', 'Mayo', 'knees']",9,1,what mario inspired mayo scream hit legs mayo knees 
2208,"I think you'd like going to the shooting range while wearing a blindfold. No, really it's great. You don't know what you're missing.","['I', 'think', 'like', 'going', 'shooting', 'range', 'wearing', 'blindfold', 'No', 'really', 'great', 'You', 'know', 'missing']",14,1,i think like going shooting range wearing blindfold no really great you know missing 
2209,Oh you kan west.,"['Oh', 'kan', 'west']",3,0,oh kan west 
2210,A man walked into a bar. He woke up in the hospital with a concussion and a bill. I wanna know where they found a duck on such short notice.,"['A', 'man', 'walked', 'bar', 'He', 'woke', 'hospital', 'concussion', 'bill', 'I', 'wanna', 'know', 'found', 'duck', 'short', 'notice']",16,1,a man walked bar he woke hospital concussion bill i wanna know found duck short notice 
2211,"You know, sometimes life gives you some curve balls. Like, today instead of my microwave heating up the plate and keeping the food cold... I found my dad in bed with the nanny.","['You', 'know', 'sometimes', 'life', 'gives', 'curve', 'balls', 'Like', 'today', 'instead', 'microwave', 'heating', 'plate', 'keeping', 'food', 'cold', 'I', 'found', 'dad', 'bed', 'nanny']",21,0,you know sometimes life gives curve balls like today instead microwave heating plate keeping food cold i found dad bed nanny 
2212,"How do Tusken Raiders cheat on their taxes? They always single file, to hide their numbers.","['How', 'Tusken', 'Raiders', 'cheat', 'taxes', 'They', 'always', 'single', 'file', 'hide', 'numbers']",11,1,how tusken raiders cheat taxes they always single file hide numbers 
2213,Women like their men how the KKK like black people... Possible Answers 1. Hung 2. Obedient.,"['Women', 'like', 'men', 'KKK', 'like', 'black', 'people', 'Possible', 'Answers', '1', 'Hung', '2', 'Obedient']",11,0,women like men kkk like black people possible answers 1 hung 2 obedient 
2214,What do you call being half in the shade and half in the sun? Pergolatory.,"['What', 'call', 'half', 'shade', 'half', 'sun', 'Pergolatory']",7,1,what call half shade half sun pergolatory 
2215,My neighbour keeps boasting about being able to take naps wherever and whenever he wants. I don’t know how he sleeps at night.,"['My', 'neighbour', 'keeps', 'boasting', 'able', 'take', 'naps', 'wherever', 'whenever', 'wants', 'I', 'know', 'sleeps', 'night']",14,1,my neighbour keeps boasting able take naps wherever whenever wants i know sleeps night 
2216,Who was Enya's favourite character in Sailor Moon? Sailor Way.,"['Who', 'Enya', 'favourite', 'character', 'Sailor', 'Moon', 'Sailor', 'Way']",8,0,who enya favourite character sailor moon sailor way 
2217,How so you call student with std? Stdent.,"['How', 'call', 'student', 'std', 'Stdent']",5,0,how call student std stdent 
2218,"Joe discovered the Tipler Cylinder, right?","['Joe', 'discovered', 'Tipler', 'Cylinder', 'right']",5,0,joe discovered tipler cylinder right 
2219,"My ""bathroom humor"" comedy routine was a failure ... I couldn't get a single laugh from the guys in the toilet stalls.","['My', 'bathroom', 'humor', 'comedy', 'routine', 'failure', 'I', 'get', 'single', 'laugh', 'guys', 'toilet', 'stalls']",13,0,my bathroom humor comedy routine failure i get single laugh guys toilet stalls 
2220,"My gay friend walks in shirtless... so i tell him “hey, topless!” he looks surprised “how did you know we broke up?”","['My', 'gay', 'friend', 'walks', 'shirtless', 'tell', 'hey', 'topless', 'looks', 'surprised', 'know', 'broke']",12,0,my gay friend walks shirtless tell hey topless looks surprised know broke 
2221,What did the bird say when it flew over Walmart? Cheap cheap cheap.,"['What', 'bird', 'say', 'flew', 'Walmart', 'Cheap', 'cheap', 'cheap']",8,1,what bird say flew walmart cheap cheap cheap 
2222,"What did the French husband say to the French wife after they had a conversation as they always do about their adorable kittens? ""I love our little chats!""","['What', 'French', 'husband', 'say', 'French', 'wife', 'conversation', 'always', 'adorable', 'kittens', 'I', 'love', 'little', 'chats']",14,1,what french husband say french wife conversation always adorable kittens i love little chats 
2223,"Last night I ordered a pizza at 11:55. When it arrived after midnight I told the delivery guy, ""I ordered this last decade.""","['Last', 'night', 'I', 'ordered', 'pizza', '11', '55', 'When', 'arrived', 'midnight', 'I', 'told', 'delivery', 'guy', 'I', 'ordered', 'last', 'decade']",16,0,last night i ordered pizza 11 55 when arrived midnight i told delivery guy i ordered last decade 
2224,Why are shooting stars so fast? They’re traveling light.,"['Why', 'shooting', 'stars', 'fast', 'They', 'traveling', 'light']",7,1,why shooting stars fast they traveling light 
2225,Why did a computer mouse dump a trackball? It didn't click between them.,"['Why', 'computer', 'mouse', 'dump', 'trackball', 'It', 'click']",7,0,why computer mouse dump trackball it click 
2226,What do you call a cow in an Earthquake? A milkshake.,"['What', 'call', 'cow', 'Earthquake', 'A', 'milkshake']",6,1,what call cow earthquake a milkshake 
2227,Why did Drake have to call a locksmith? Because he forgot his Kiki.,"['Why', 'Drake', 'call', 'locksmith', 'Because', 'forgot', 'Kiki']",7,0,why drake call locksmith because forgot kiki 
