,joke,tokens,token_count,funny,clean_text
0,What vocal group always kills? The OJs.,"['What', 'vocal', 'group', 'always', 'kills', 'The', 'OJs']",7,0,what vocal group always kills the ojs 
1,Why is it good to be friends with a rheumatologist? They know where all of the hip joints in town are.,"['Why', 'good', 'friends', 'rheumatologist', 'They', 'know', 'hip', 'joints', 'town']",9,0,why good friends rheumatologist they know hip joints town 
2,French people don’t masturbate … They jacques off.,"['French', 'people', 'masturbate', 'They', 'jacques']",5,1,french people masturbate they jacques 
3,Did you hear about the cow who participated in a singing contest? It wanted to be a Moosician.,"['Did', 'hear', 'cow', 'participated', 'singing', 'contest', 'It', 'wanted', 'Moosician']",9,0,did hear cow participated singing contest it wanted moosician 
4,"What did Elmer Fudd say after he joined the war on religion? Be very very quiet, I'm hunting abbots.","['What', 'Elmer', 'Fudd', 'say', 'joined', 'war', 'religion', 'Be', 'quiet', 'I', 'hunting', 'abbots']",12,1,what elmer fudd say joined war religion be quiet i hunting abbots 
5,Whats the difference between Rick and Patrick? &gt;!Pat /pat/ a light gentle touch with the flat of the hand!&lt;,"['Whats', 'difference', 'Rick', 'Patrick', 'gt', 'Pat', 'pat', 'light', 'gentle', 'touch', 'flat', 'hand', 'lt']",13,1,whats difference rick patrick gt pat pat light gentle touch flat hand lt 
6,What do you call someone who is afraid of and/or hostile to gnomes? Gnomophobic!,"['What', 'call', 'someone', 'afraid', 'hostile', 'gnomes', 'Gnomophobic']",7,0,what call someone afraid hostile gnomes gnomophobic 
7,"Everyone knows what the first man on the moon said, but what about the second one? ""Neil before me""","['Everyone', 'knows', 'first', 'man', 'moon', 'said', 'second', 'one', 'Neil']",9,1,everyone knows first man moon said second one neil 
8,"(OC) Isn't ""peeping Tom"" a euphemism? No, wait. It's an in-ya-window.","['OC', 'Isn', 'peeping', 'Tom', 'euphemism', 'No', 'wait', 'It', 'ya', 'window']",10,1,oc isn peeping tom euphemism no wait it ya window 
9,What did the Flower ask the Bee? Is that your stinger showing or are you just happy to see me?,"['What', 'Flower', 'ask', 'Bee', 'Is', 'stinger', 'showing', 'happy', 'see']",9,0,what flower ask bee is stinger showing happy see 
10,"Are you an existing user? ""Let me think about it "" said Descartes.","['Are', 'existing', 'user', 'Let', 'think', 'said', 'Descartes']",7,0,are existing user let think said descartes 
11,This girl called me and told me she wanted to be tied up... so I told her to balance my accounts receivable.,"['This', 'girl', 'called', 'told', 'wanted', 'tied', 'I', 'told', 'balance', 'accounts', 'receivable']",11,0,this girl called told wanted tied i told balance accounts receivable 
12,Never pour sulphuric acid into a metal beaker... It's an oxidant waiting to happen.,"['Never', 'pour', 'sulphuric', 'acid', 'metal', 'beaker', 'It', 'oxidant', 'waiting', 'happen']",10,1,never pour sulphuric acid metal beaker it oxidant waiting happen 
13,"I built a model of Mount Everest and my son asked if it was to scale. ""No,"" I said. ""It's to look at.""","['I', 'built', 'model', 'Mount', 'Everest', 'son', 'asked', 'scale', 'No', 'I', 'said', 'It', 'look']",13,1,i built model mount everest son asked scale no i said it look 
14,"Be careful when buying tickets to Dr. strange. I found out later that he was out of network and instead of the ticket costing me $12, I ended up paying $5660","['Be', 'careful', 'buying', 'tickets', 'Dr', 'strange', 'I', 'found', 'later', 'network', 'instead', 'ticket', 'costing', '12', 'I', 'ended', 'paying', '5660']",16,1,be careful buying tickets dr strange i found later network instead ticket costing 12 i ended paying 5660 
15,How will be called the natural ice cream? Ice green.,"['How', 'called', 'natural', 'ice', 'cream', 'Ice', 'green']",7,0,how called natural ice cream ice green 
16,What do electricians get for Christmas? Shorts!,"['What', 'electricians', 'get', 'Christmas', 'Shorts']",5,1,what electricians get christmas shorts 
17,"Why is it so hard to find a needle in a haystack? Just use a magnet, goddammit!","['Why', 'hard', 'find', 'needle', 'haystack', 'Just', 'use', 'magnet', 'goddammit']",9,1,why hard find needle haystack just use magnet goddammit 
18,Men swear too you know.,"['Men', 'swear', 'know']",3,0,men swear know 
19,"Don't drink water! 100% of people who do, dies.","['Don', 'drink', 'water', '100', 'people', 'dies']",5,1,don drink water 100 people dies 
20,Czech Republic have closed all their schools. I’m guessing they’ve czeched themselves before they recked themselves.,"['Czech', 'Republic', 'closed', 'schools', 'I', 'guessing', 'czeched', 'recked']",8,0,czech republic closed schools i guessing czeched recked 
21,The Vampire double checked the order form to understand why his latest shipment of AB+ was incorrect. Type-o.,"['The', 'Vampire', 'double', 'checked', 'order', 'form', 'understand', 'latest', 'shipment', 'AB', 'incorrect', 'Type']",12,1,the vampire double checked order form understand latest shipment ab incorrect type 
22,What would Napoleon's name have been if he would have been born a Siamese twin? Napoleon Bontogether!,"['What', 'would', 'Napoleon', 'name', 'would', 'born', 'Siamese', 'twin', 'Napoleon', 'Bontogether']",10,0,what would napoleon name would born siamese twin napoleon bontogether 
23,Socratic teachers literally only want one thing. and it’s discussing.,"['Socratic', 'teachers', 'literally', 'want', 'one', 'thing', 'discussing']",7,1,socratic teachers literally want one thing discussing 
24,What do you call a crazy right-wing Israeli Prime Minister? Nutty-yahoo!,"['What', 'call', 'crazy', 'right', 'wing', 'Israeli', 'Prime', 'Minister', 'Nutty', 'yahoo']",10,0,what call crazy right wing israeli prime minister nutty yahoo 
25,When I turned 18 I drove around with some friends and got mad drunk. I was a dolt.,"['When', 'I', 'turned', '18', 'I', 'drove', 'around', 'friends', 'got', 'mad', 'drunk', 'I', 'dolt']",12,1,when i turned 18 i drove around friends got mad drunk i dolt 
26,A girl at work decided to get a face tattoo of her favorite Star Wars character. You should’ve seen the Luke on her face.,"['A', 'girl', 'work', 'decided', 'get', 'face', 'tattoo', 'favorite', 'Star', 'Wars', 'character', 'You', 'seen', 'Luke', 'face']",15,1,a girl work decided get face tattoo favorite star wars character you seen luke face 
27,Mother’s Day always makes me miss my dad. Before he died he spent his entire life fighting for women’s rights. Mom wanted to get involved too but he said her place was at home with us kids.,"['Mother', 'Day', 'always', 'makes', 'miss', 'dad', 'Before', 'died', 'spent', 'entire', 'life', 'fighting', 'women', 'rights', 'Mom', 'wanted', 'get', 'involved', 'said', 'place', 'home', 'us', 'kids']",23,1,mother day always makes miss dad before died spent entire life fighting women rights mom wanted get involved said place home us kids 
28,A tornado blew through a French cheese factory... De-Brie was everywhere!,"['A', 'tornado', 'blew', 'French', 'cheese', 'factory', 'De', 'Brie', 'everywhere']",9,1,a tornado blew french cheese factory de brie everywhere 
29,What do you call a guy who uses Juul? Juulian!,"['What', 'call', 'guy', 'uses', 'Juul', 'Juulian']",6,0,what call guy uses juul juulian 
30,titles are hard. I had a dream I was a muffler last night when I woke up I was so exhausted.,"['titles', 'hard', 'I', 'dream', 'I', 'muffler', 'last', 'night', 'I', 'woke', 'I', 'exhausted']",12,1,titles hard i dream i muffler last night i woke i exhausted 
31,My kind of men 😏😂,"['My', 'kind', 'men']",3,0,my kind men 
32,Are you alright?? No you’re all left.,"['Are', 'alright', 'No', 'left']",4,0,are alright no left 
33,People in stores are fighting over toilet paper! Not very Charmin',"['People', 'stores', 'fighting', 'toilet', 'paper', 'Not', 'Charmin']",7,0,people stores fighting toilet paper not charmin 
34,What did the chicken pay the rooster? A buck (Courtesy of my 8 year old son),"['What', 'chicken', 'pay', 'rooster', 'A', 'buck', 'Courtesy', '8', 'year', 'old', 'son']",10,0,what chicken pay rooster a buck courtesy 8 year old son 
35,I heard Kobe Bryant was very strict towards his daughter in multiple ways. I guess… you could maybe call him a … helicopter parent?,"['I', 'heard', 'Kobe', 'Bryant', 'strict', 'towards', 'daughter', 'multiple', 'ways', 'I', 'guess', 'could', 'maybe', 'call', 'helicopter', 'parent']",16,1,i heard kobe bryant strict towards daughter multiple ways i guess could maybe call helicopter parent 
36,A boulder rolled over and squashed a man. It's was a stone-cold murder.,"['A', 'boulder', 'rolled', 'squashed', 'man', 'It', 'stone', 'cold', 'murder']",9,0,a boulder rolled squashed man it stone cold murder 
37,The name’s Goldenfield. Nice to Wheat You.,"['The', 'name', 'Goldenfield', 'Nice', 'Wheat', 'You']",6,1,the name goldenfield nice wheat you 
38,This joke is no longer true! And is therefore a bad joke. \#toosoon \#sorrynotsorry,"['This', 'joke', 'longer', 'true', 'And', 'therefore', 'bad', 'joke', 'toosoon', 'sorrynotsorry']",10,0,this joke longer true and therefore bad joke toosoon sorrynotsorry 
39,My dad died last night. I can't stop crying.,"['My', 'dad', 'died', 'last', 'night', 'I', 'stop', 'crying']",8,0,my dad died last night i stop crying 
40,I got fired from my job as a courier. I just wasn't delivering.,"['I', 'got', 'fired', 'job', 'courier', 'I', 'delivering']",7,1,i got fired job courier i delivering 
41,No-way.,"['No', 'way']",2,0,no way 
42,Why don't you ever hear bunnies having sex? Cotton balls.,"['Why', 'ever', 'hear', 'bunnies', 'sex', 'Cotton', 'balls']",7,1,why ever hear bunnies sex cotton balls 
43,What do binary code and me have in common? We're both just 0's and 1's.,"['What', 'binary', 'code', 'common', 'We', '0', '1']",5,0,what binary code common we 0 1 
44,"Not only do I have a tag with my contact details on the outside of my suitcase, I also have one on the inside. Just in case.","['Not', 'I', 'tag', 'contact', 'details', 'outside', 'suitcase', 'I', 'also', 'one', 'inside', 'Just', 'case']",13,1,not i tag contact details outside suitcase i also one inside just case 
45,What do you call a hyena that gets put into a pie? A pie-ena!,"['What', 'call', 'hyena', 'gets', 'put', 'pie', 'A', 'pie', 'ena']",9,0,what call hyena gets put pie a pie ena 
46,Elton John’s E-reader was swept up in a tornado…. Like a Kindle in the wind.,"['Elton', 'John', 'E', 'reader', 'swept', 'tornado', 'Like', 'Kindle', 'wind']",9,1,elton john e reader swept tornado like kindle wind 
47,What do you call a group of 12 well endowed men? A hung jury!,"['What', 'call', 'group', '12', 'well', 'endowed', 'men', 'A', 'hung', 'jury']",9,0,what call group 12 well endowed men a hung jury 
48,"A man walked up to god and asked what his favorite social media was. God was about to answer, but as he was, he notices that a massive rock has collided into Earth and destroyed it without him noticing it's approach. God, distraught, said, ""My Space! Why?"" The man replied, ""No real reason, I was just curious.""","['A', 'man', 'walked', 'god', 'asked', 'favorite', 'social', 'media', 'God', 'answer', 'notices', 'massive', 'rock', 'collided', 'Earth', 'destroyed', 'without', 'noticing', 'approach', 'God', 'distraught', 'said', 'My', 'Space', 'Why', 'The', 'man', 'replied', 'No', 'real', 'reason', 'I', 'curious']",33,0,a man walked god asked favorite social media god answer notices massive rock collided earth destroyed without noticing approach god distraught said my space why the man replied no real reason i curious 
49,What's a sheep's favorite Dolly Parton song? I Will Always Love Ewe.,"['What', 'sheep', 'favorite', 'Dolly', 'Parton', 'song', 'I', 'Will', 'Always', 'Love', 'Ewe']",11,0,what sheep favorite dolly parton song i will always love ewe 
50,ITS JUST A JOKE....,"['ITS', 'JUST', 'A', 'JOKE']",4,0,its just a joke 
51,What do you call a freezing baby? Youth in ice.,"['What', 'call', 'freezing', 'baby', 'Youth', 'ice']",6,0,what call freezing baby youth ice 
52,Someone joked about my face... They were so mien!,"['Someone', 'joked', 'face', 'They', 'mien']",5,1,someone joked face they mien 
53,I've been searching all over YouTube for my favorite U2 song. But I Still Haven't Found What I'm Looking For.,"['I', 'searching', 'YouTube', 'favorite', 'U2', 'song', 'But', 'I', 'Still', 'Haven', 'Found', 'What', 'I', 'Looking', 'For']",14,1,i searching youtube favorite u2 song but i still haven found what i looking for 
54,if you ever feel cold just stand in a corner. They're usually around 90°,"['ever', 'feel', 'cold', 'stand', 'corner', 'They', 'usually', 'around', '90']",8,1,ever feel cold stand corner they usually around 90 
55,Did you hear about the cow who participated in a singing contest? It wanted to be a Moosician.,"['Did', 'hear', 'cow', 'participated', 'singing', 'contest', 'It', 'wanted', 'Moosician']",9,0,did hear cow participated singing contest it wanted moosician 
56,My wife and I let astrology get between us. **It Taurus apart**,"['My', 'wife', 'I', 'let', 'astrology', 'get', 'us', 'It', 'Taurus', 'apart']",10,1,my wife i let astrology get us it taurus apart 
57,all these jokes are so bad that ther good and bad at the same time.,"['jokes', 'bad', 'ther', 'good', 'bad', 'time']",6,0,jokes bad ther good bad time 
58,I was scolded today for using the “P” word. He said that’s arrrrr word.,"['I', 'scolded', 'today', 'using', 'P', 'word', 'He', 'said', 'arrrrr', 'word']",10,1,i scolded today using p word he said arrrrr word 
59,Really Bad Jokes.,"['Really', 'Bad', 'Jokes']",3,0,really bad jokes 
60,What does Mark Zuckerberg sound like during sex? A dial-up modem --- [Related tweet](https://twitter.com/InternetHippo/status/1187171556126023680),"['What', 'Mark', 'Zuckerberg', 'sound', 'like', 'sex', 'A', 'dial', 'modem', 'Related', 'tweet', 'https', 'twitter', 'com', 'InternetHippo', 'status', '1187171556126023680']",16,0,what mark zuckerberg sound like sex a dial modem related tweet https twitter com internethippo status 1187171556126023680 
61,Who is the most positive composer? Rimsky-Of-Korsakov.,"['Who', 'positive', 'composer', 'Rimsky', 'Of', 'Korsakov']",6,1,who positive composer rimsky of korsakov 
62,"What's the English teacher's favorite song? ,,,,, chameleon.","['What', 'English', 'teacher', 'favorite', 'song', 'chameleon']",6,0,what english teacher favorite song chameleon 
63,"The two fishermen. Two fishermen are racing to catch a new species called Drift. The first one is more experienced and does fishing daily. The second one, however, is less experienced and is well aware of the first fisherman's superior skills. So the snobbish person he is, he says to the first fisherman, ""I'll kill you, if you catch my Drift.""","['The', 'two', 'fishermen', 'Two', 'fishermen', 'racing', 'catch', 'new', 'species', 'called', 'Drift', 'The', 'first', 'one', 'experienced', 'fishing', 'daily', 'The', 'second', 'one', 'however', 'less', 'experienced', 'well', 'aware', 'first', 'fisherman', 'superior', 'skills', 'So', 'snobbish', 'person', 'says', 'first', 'fisherman', 'I', 'kill', 'catch', 'Drift']",39,0,the two fishermen two fishermen racing catch new species called drift the first one experienced fishing daily the second one however less experienced well aware first fisherman superior skills so snobbish person says first fisherman i kill catch drift 
64,Some people say that Blazing Saddles couldn't be made today. I guess it's true since most of the actors who starred in it are dead.,"['Some', 'people', 'say', 'Blazing', 'Saddles', 'made', 'today', 'I', 'guess', 'true', 'since', 'actors', 'starred', 'dead']",14,0,some people say blazing saddles made today i guess true since actors starred dead 
65,"Today, my mum asked ""Can you pass me a book mark?"" I burst into tears.. 24 years old and she doesn't know my name is Scott.","['Today', 'mum', 'asked', 'Can', 'pass', 'book', 'mark', 'I', 'burst', 'tears', '24', 'years', 'old', 'know', 'name', 'Scott']",15,0,today mum asked can pass book mark i burst tears 24 years old know name scott 
66,You know where kings keep their armies? In their sleevies.,"['You', 'know', 'kings', 'keep', 'armies', 'In', 'sleevies']",7,1,you know kings keep armies in sleevies 
67,"What happens when Johnny Cash gets knocked out in a pro boxing fight, but the ropes are ignited? Hed go down in a burning ring of fire..","['What', 'happens', 'Johnny', 'Cash', 'gets', 'knocked', 'pro', 'boxing', 'fight', 'ropes', 'ignited', 'Hed', 'go', 'burning', 'ring', 'fire']",16,0,what happens johnny cash gets knocked pro boxing fight ropes ignited hed go burning ring fire 
68,What do you call a gay man from Tulsa? Oklahomo.,"['What', 'call', 'gay', 'man', 'Tulsa', 'Oklahomo']",6,0,what call gay man tulsa oklahomo 
69,"I was sitting on the end of my bed pulling my boxers off, My wife said “gee you spoil those dogs”","['I', 'sitting', 'end', 'bed', 'pulling', 'boxers', 'My', 'wife', 'said', 'gee', 'spoil', 'dogs']",12,1,i sitting end bed pulling boxers my wife said gee spoil dogs 
70,"What did the road-raging SJW say? ""Stay in your lane!""","['What', 'road', 'raging', 'SJW', 'say', 'Stay', 'lane']",7,0,what road raging sjw say stay lane 
71,"I had a Wacom Tablet. But I cant find it, i don’t k ow I guess it walked off.","['I', 'Wacom', 'Tablet', 'But', 'I', 'cant', 'find', 'k', 'ow', 'I', 'guess', 'walked']",12,0,i wacom tablet but i cant find k ow i guess walked 
72,"My girlfriend wanted to look sexier so she took a drug that made her butt bigger. Unfortunately, the drug was so effective that it caused a mass extinction. What kind of drug did she take? An ass-steroid.","['My', 'girlfriend', 'wanted', 'look', 'sexier', 'took', 'drug', 'made', 'butt', 'bigger', 'Unfortunately', 'drug', 'effective', 'caused', 'mass', 'extinction', 'What', 'kind', 'drug', 'take', 'An', 'ass', 'steroid']",23,0,my girlfriend wanted look sexier took drug made butt bigger unfortunately drug effective caused mass extinction what kind drug take an ass steroid 
73,What's a Pirate's favorite letter of the alphabet? Mooooo!,"['What', 'Pirate', 'favorite', 'letter', 'alphabet', 'Mooooo']",6,0,what pirate favorite letter alphabet mooooo 
74,What did Arnold Schwarzenegger do when he quit being the Terminator? He became an ExTerminator.,"['What', 'Arnold', 'Schwarzenegger', 'quit', 'Terminator', 'He', 'became', 'ExTerminator']",8,1,what arnold schwarzenegger quit terminator he became exterminator 
75,My husband is definitely a dad... This conversation just happened: Me: I have a secret chocolate stash. I saw a Heath bar double pack and I bought them. I ate one and hid the other one. Hubbs: You should keep a tally of how many Heath bars you buy. Me: ... Why? Hubbs: So you can have a Heath Ledger! Me: ... ... ...,"['My', 'husband', 'definitely', 'dad', 'This', 'conversation', 'happened', 'Me', 'I', 'secret', 'chocolate', 'stash', 'I', 'saw', 'Heath', 'bar', 'double', 'pack', 'I', 'bought', 'I', 'ate', 'one', 'hid', 'one', 'Hubbs', 'You', 'keep', 'tally', 'many', 'Heath', 'bars', 'buy', 'Me', 'Why', 'Hubbs', 'So', 'Heath', 'Ledger', 'Me']",40,1,my husband definitely dad this conversation happened me i secret chocolate stash i saw heath bar double pack i bought i ate one hid one hubbs you keep tally many heath bars buy me why hubbs so heath ledger me 
76,Why did the computer sneeze? It had a virus.,"['Why', 'computer', 'sneeze', 'It', 'virus']",5,1,why computer sneeze it virus 
77,"""Students, we're learning about the Middle East today!"" ""First, there's a country called Oman."" ""Oh, man!"" ""Then, there's a country called Yemen."" ""Yeah, man!""","['Students', 'learning', 'Middle', 'East', 'today', 'First', 'country', 'called', 'Oman', 'Oh', 'man', 'Then', 'country', 'called', 'Yemen', 'Yeah', 'man']",17,0,students learning middle east today first country called oman oh man then country called yemen yeah man 
78,"My husband and I were arguing over who's family is better. When I said that my family was better, my husband retorted, ""Yeah? Well my in-laws are better!""","['My', 'husband', 'I', 'arguing', 'family', 'better', 'When', 'I', 'said', 'family', 'better', 'husband', 'retorted', 'Yeah', 'Well', 'laws', 'better']",17,0,my husband i arguing family better when i said family better husband retorted yeah well laws better 
79,What type of bears suffer from mental illness? BiPolar Bears.,"['What', 'type', 'bears', 'suffer', 'mental', 'illness', 'BiPolar', 'Bears']",8,1,what type bears suffer mental illness bipolar bears 
80,Condoms? Ha those are for pussies!,"['Condoms', 'Ha', 'pussies']",3,0,condoms ha pussies 
81,why did the farm owners make the chicken do jumping jacks. because they wanted scrambled eggs.,"['farm', 'owners', 'make', 'chicken', 'jumping', 'jacks', 'wanted', 'scrambled', 'eggs']",9,1,farm owners make chicken jumping jacks wanted scrambled eggs 
82,My buddy and his wife own a pot shop but now they're getting divorced. I told him to go for joint custody.,"['My', 'buddy', 'wife', 'pot', 'shop', 'getting', 'divorced', 'I', 'told', 'go', 'joint', 'custody']",12,1,my buddy wife pot shop getting divorced i told go joint custody 
83,"Just went in a fight against 1, 3, 5, 7 and 9 Odds were against me.","['Just', 'went', 'fight', '1', '3', '5', '7', '9', 'Odds']",4,1,just went fight 1 3 5 7 9 odds 
84,"In light of recent events, I'm thinking about a new game Kickstarter...","['In', 'light', 'recent', 'events', 'I', 'thinking', 'new', 'game', 'Kickstarter']",9,0,in light recent events i thinking new game kickstarter 
85,Carmen Sandiego was supposed to meet me for brunch an hour ago. Where in the world is she?,"['Carmen', 'Sandiego', 'supposed', 'meet', 'brunch', 'hour', 'ago', 'Where', 'world']",9,1,carmen sandiego supposed meet brunch hour ago where world 
86,Does anyone know why the butcher is always involved in drama? He seems to always have a lot of beef.,"['Does', 'anyone', 'know', 'butcher', 'always', 'involved', 'drama', 'He', 'seems', 'always', 'lot', 'beef']",12,1,does anyone know butcher always involved drama he seems always lot beef 
87,What is a policeman's favorite song? The wee woo.,"['What', 'policeman', 'favorite', 'song', 'The', 'wee', 'woo']",7,0,what policeman favorite song the wee woo 
88,What do you call someone who wanders around Italy? Roman.,"['What', 'call', 'someone', 'wanders', 'around', 'Italy', 'Roman']",7,1,what call someone wanders around italy roman 
89,Yo mama's so dumb... When you asked her for a Transformer for Christmas she got you the Lou Reed album!,"['Yo', 'mama', 'dumb', 'When', 'asked', 'Transformer', 'Christmas', 'got', 'Lou', 'Reed', 'album']",11,0,yo mama dumb when asked transformer christmas got lou reed album 
90,What is the absolute most organic type of pasta? Carbonara.,"['What', 'absolute', 'organic', 'type', 'pasta', 'Carbonara']",6,1,what absolute organic type pasta carbonara 
91,I made a Noah schnapp joke. What do you get if you take away the first two letters of Noah Schnapp? Ah Schnapp! ( it’s bad but it made my sister disown me so :) ),"['I', 'made', 'Noah', 'schnapp', 'joke', 'What', 'get', 'take', 'away', 'first', 'two', 'letters', 'Noah', 'Schnapp', 'Ah', 'Schnapp', 'bad', 'made', 'sister', 'disown']",20,0,i made noah schnapp joke what get take away first two letters noah schnapp ah schnapp bad made sister disown 
92,Why was Einstein afraid of 7? Because 7 8 Einstein.,"['Why', 'Einstein', 'afraid', '7', 'Because', '7', '8', 'Einstein']",5,0,why einstein afraid 7 because 7 8 einstein 
93,What did the pirate say on his 80th birthday?? Aye matey!!,"['What', 'pirate', 'say', '80th', 'birthday', 'Aye', 'matey']",6,1,what pirate say 80th birthday aye matey 
94,"This is Us? More like This was Utz, because that one actress on it looks like she ate a potato chip factory!","['This', 'Us', 'More', 'like', 'This', 'Utz', 'one', 'actress', 'looks', 'like', 'ate', 'potato', 'chip', 'factory']",14,0,this us more like this utz one actress looks like ate potato chip factory 
95,Why did the Chicken Cross the Road.,"['Why', 'Chicken', 'Cross', 'Road']",4,0,why chicken cross road 
96,What do you call a deer with no eyes? I have no idea.,"['What', 'call', 'deer', 'eyes', 'I', 'idea']",6,0,what call deer eyes i idea 
97,What do you call a lesbian version of Yu-Gi-Oh! Yuri-Oh!,"['What', 'call', 'lesbian', 'version', 'Yu', 'Gi', 'Oh', 'Yuri', 'Oh']",9,0,what call lesbian version yu gi oh yuri oh 
98,"Two chemists walk into a bar. The first one says, ""I'll have some H2O."" The second says, ""I'll have some water too. But why'd you order it like that? We aren't at work."" The first﻿ chemist excuses himself and weeps in the bathroom. His assassination plot had failed.","['Two', 'chemists', 'walk', 'bar', 'The', 'first', 'one', 'says', 'I', 'H2O', 'The', 'second', 'says', 'I', 'water', 'But', 'order', 'like', 'We', 'work', 'The', 'first', 'chemist', 'excuses', 'weeps', 'bathroom', 'His', 'assassination', 'plot', 'failed']",29,1,two chemists walk bar the first one says i h2o the second says i water but order like we work the first chemist excuses weeps bathroom his assassination plot failed 
99,I completely forgot about this!,"['I', 'completely', 'forgot']",3,0,i completely forgot 
100,What do you call karate for amputees. Partial arts.,"['What', 'call', 'karate', 'amputees', 'Partial', 'arts']",6,0,what call karate amputees partial arts 
101,In 1903 two brothers believed that man could fly. They were Wright.,"['In', '1903', 'two', 'brothers', 'believed', 'man', 'could', 'fly', 'They', 'Wright']",9,0,in 1903 two brothers believed man could fly they wright 
102,When did the drill know he messed up? When he screwed up.,"['When', 'drill', 'know', 'messed', 'When', 'screwed']",6,1,when drill know messed when screwed 
